_id,Response,Actors,imdbID,Box_office,Director,Writer,Awards,Title,Rated,imdbVotes,imdbRating,Type,Genre,Released,Poster,Runtime,Metascore,Language,Country
56fb965e71a0650fe43395e9,True,"Eddie Murphy, Judge Reinhold, John Ashton, Lisa Eilbacher",tt0086960,"234,760,500",Martin Brest,"Daniel Petrie Jr. (screenplay, Danilo Bach (story, Daniel Petrie Jr. (story)",Nominated for 1 Oscar. Another 3 wins & 4 nominations.,Beverly Hills Cop,R,"122,254",7.3,movie,"Action, Comedy, Crime",05 Dec 1984,http://ia.media-imdb.com/images/M/MV5BNzMyMjQ2OTEwOF5BMl5BanBnXkFtZTgwNzc2OTkwMDE@._V1_SX300.jpg,105 min,64,English,USA
56fb965e71a0650fe43395ea,True,"Bill Murray, Dan Aykroyd, Sigourney Weaver, Harold Ramis",tt0087332,"229,242,989",Ivan Reitman,"Dan Aykroyd, Harold Ramis",Nominated for 2 Oscars. Another 5 wins & 6 nominations.,Ghostbusters,PG,"252,631",7.8,movie,"Adventure, Comedy, Fantasy",08 Jun 1984,http://ia.media-imdb.com/images/M/MV5BMTkxMjYyNzgwMl5BMl5BanBnXkFtZTgwMTE3MjYyMTE@._V1_SX300.jpg,105 min,67,English,USA
56fb965e71a0650fe43395eb,True,"Harrison Ford, Kate Capshaw, Jonathan Ke Quan, Amrish Puri",tt0087469,"179,870,271",Steven Spielberg,"Willard Huyck (screenplay, Gloria Katz (screenplay, George Lucas (story)",Won 1 Oscar. Another 6 wins & 20 nominations.,Indiana Jones and the Temple of Doom,PG,"315,789",7.6,movie,"Action, Adventure",23 May 1984,http://ia.media-imdb.com/images/M/MV5BMTMyNzI4OTA5OV5BMl5BanBnXkFtZTcwMDQ2MjAxNA@@._V1_SX300.jpg,118 min,57,"English, Sinhalese",USA
56fb965e71a0650fe43395ec,True,"Hoyt Axton, John Louie, Keye Luke, Don Steele",tt0087363,"148,170,000",Joe Dante,Chris Columbus,7 wins & 6 nominations.,Gremlins,PG,"135,208",7.2,movie,"Comedy, Fantasy, Horror",08 Jun 1984,http://ia.media-imdb.com/images/M/MV5BMTU4Njk2MzU4Ml5BMl5BanBnXkFtZTYwNjE1MTg4._V1_SX300.jpg,106 min,N/A,"English, Spanish",USA
56fb965e71a0650fe43395ed,True,"Ralph Macchio, Pat Morita, Elisabeth Shue, Martin Kove",tt0087538,"90,800,000",John G. Avildsen,Robert Mark Kamen,Nominated for 1 Oscar. Another 2 wins & 2 nominations.,The Karate Kid,PG,"121,433",7.2,movie,"Action, Drama, Family",22 Jun 1984,http://ia.media-imdb.com/images/M/MV5BMTkyNjE3MjM2MV5BMl5BanBnXkFtZTYwMzY5ODk4._V1_SX300.jpg,126 min,N/A,"English, Japanese",USA
56fb965e71a0650fe43395ee,True,"Steve Guttenberg, Kim Cattrall, G.W. Bailey, Bubba Smith",tt0087928,"81,200,000",Hugh Wilson,"Neal Israel (screenplay, Pat Proft (screenplay, Hugh Wilson (screenplay, Neal Israel (story, Pat Proft (story)",1 win.,Police Academy,R,"84,855",6.6,movie,Comedy,23 Mar 1984,http://ia.media-imdb.com/images/M/MV5BMTQ3NTU4NzY5Ml5BMl5BanBnXkFtZTcwNDk0ODUyMQ@@._V1_SX300.jpg,96 min,41,English,USA
56fb965e71a0650fe43395ef,True,"Kevin Bacon, Lori Singer, John Lithgow, Dianne Wiest",tt0087277,"80,000,000",Herbert Ross,Dean Pitchford,Nominated for 2 Oscars. Another 1 win & 4 nominations.,Footloose,PG,"49,370",6.5,movie,"Drama, Music, Romance",17 Feb 1984,http://ia.media-imdb.com/images/M/MV5BMTYwMzgzNDAzM15BMl5BanBnXkFtZTYwODY0NjU5._V1_SX300.jpg,107 min,N/A,English,USA
56fb965e71a0650fe43395f0,True,"Michael Douglas, Kathleen Turner, Danny DeVito, Zack Norman",tt0088011,"74,900,000",Robert Zemeckis,Diane Thomas,Nominated for 1 Oscar. Another 5 wins & 3 nominations.,Romancing the Stone,PG,"62,221",6.9,movie,"Action, Adventure, Comedy",30 Mar 1984,http://ia.media-imdb.com/images/M/MV5BMjEyMTYyNjcwMV5BMl5BanBnXkFtZTcwOTEyNjQzMQ@@._V1_SX300.jpg,106 min,N/A,"English, Spanish, French","USA, Mexico"
56fb965e71a0650fe43395f1,True,"William Shatner, Leonard Nimoy, DeForest Kelley, James Doohan",tt0088170,"76,400,000",Leonard Nimoy,"Gene Roddenberry (television series Star Trek, Harve Bennett",7 nominations.,Star Trek III: The Search for Spock,PG,"56,546",6.6,movie,"Action, Adventure, Sci-Fi",01 Jun 1984,http://ia.media-imdb.com/images/M/MV5BMTc5NDY1OTU0Ml5BMl5BanBnXkFtZTcwNDIwNDI4OA@@._V1_SX300.jpg,105 min,55,"English, Klingon, Russian, French",USA
56fb965e71a0650fe43395f2,True,"Tom Hanks, Daryl Hannah, Eugene Levy, John Candy",tt0088161,"69,800,000",Ron Howard,"Brian Grazer (story, Bruce Jay Friedman (screen story, Lowell Ganz (screenplay, Babaloo Mandel (screenplay, Bruce Jay Friedman (screenplay)",Nominated for 1 Oscar. Another 2 wins & 8 nominations.,Splash,PG,"52,992",6.2,movie,"Comedy, Fantasy, Romance",09 Mar 1984,http://ia.media-imdb.com/images/M/MV5BMTgyNjg0NzI4NF5BMl5BanBnXkFtZTcwMzE5OTQyMQ@@._V1_SX300.jpg,111 min,N/A,"English, Swedish",USA
56fb965e71a0650fe43395f3,True,"Prince, Apollonia Kotero, Morris Day, Olga Karlatos",tt0087957,,Albert Magnoli,"Albert Magnoli, William Blinn",Won 1 Oscar. Another 4 wins & 4 nominations.,Purple Rain,R,"11,625",6.3,movie,"Drama, Music, Musical",27 Jul 1984,http://ia.media-imdb.com/images/M/MV5BMTk1ODQ1MzgxM15BMl5BanBnXkFtZTcwMTM1NzMyMQ@@._V1_SX300.jpg,111 min,45,English,USA
56fb965e71a0650fe43395f4,True,"F. Murray Abraham, Tom Hulce, Elizabeth Berridge, Roy Dotrice",tt0086879,"51,600,000",Milos Forman,"Peter Shaffer (original stage play, Peter Shaffer (original screenplay)",Won 8 Oscars. Another 33 wins & 14 nominations.,Amadeus,R,"260,364",8.3,movie,"Biography, Drama, Music",05 Apr 1985,http://ia.media-imdb.com/images/M/MV5BMTg5NDkwMTk5N15BMl5BanBnXkFtZTYwODg3MDk2._V1_SX300.jpg,160 min,93,"English, Italian, Latin, German","USA, France"
56fb965e71a0650fe43395f5,True,"Clint Eastwood, Geneviève Bujold, Dan Hedaya, Alison Eastwood",tt0088272,,Richard Tuggle,Richard Tuggle (screenplay),1 nomination.,Tightrope,R,"11,114",6.3,movie,"Mystery, Thriller",17 Aug 1984,http://ia.media-imdb.com/images/M/MV5BMTM1ODUzNDI5NF5BMl5BanBnXkFtZTYwNjc4NDE5._V1_SX300.jpg,114 min,N/A,English,USA
56fb965e71a0650fe43395f6,True,"Robert Redford, Robert Duvall, Glenn Close, Kim Basinger",tt0087781,"48,000,000",Barry Levinson,"Bernard Malamud (novel, Roger Towne, Phil Dusenberry",Nominated for 4 Oscars. Another 3 wins & 4 nominations.,The Natural,PG,"33,721",7.5,movie,"Drama, Sport",11 May 1984,http://ia.media-imdb.com/images/M/MV5BMTQ0MzQ4ODQzNV5BMl5BanBnXkFtZTcwNTY2NzI0MQ@@._V1_SX300.jpg,138 min,N/A,English,USA
56fb965e71a0650fe43395f7,True,"Ralph Richardson, Ian Holm, James Fox, Christopher Lambert",tt0087365,"45,900,000",Hugh Hudson,"Edgar Rice Burroughs (novel, Robert Towne, Michael Austin",Nominated for 3 Oscars. Another 3 wins & 12 nominations.,"Greystoke: The Legend of Tarzan, Lord of the Apes",PG,"14,301",6.3,movie,"Adventure, Drama",30 Mar 1984,http://ia.media-imdb.com/images/M/MV5BMTM5MzcwOTg4MF5BMl5BanBnXkFtZTgwOTQwMzQxMDE@._V1_SX300.jpg,135 min,N/A,"English, French","UK, USA"
56fb965e71a0650fe43395f8,True,"Robert Carradine, Anthony Edwards, Timothy Busfield, Andrew Cassese",tt0088000,"40,900,000",Jeff Kanew,"Tim Metcalfe (story, Miguel Tejada-Flores (story, Steve Zacharias (story, Jeff Buhai (story, Steve Zacharias (screenplay, Jeff Buhai (screenplay)",N/A,Revenge of the Nerds,R,"38,824",6.6,movie,Comedy,10 Aug 1984,http://ia.media-imdb.com/images/M/MV5BODU1NzM4NTA4Nl5BMl5BanBnXkFtZTgwMTkxMzcxMTE@._V1_SX300.jpg,90 min,41,English,USA
56fb965e71a0650fe43395f9,True,"Roy Scheider, John Lithgow, Helen Mirren, Bob Balaban",tt0086837,,Peter Hyams,"Arthur C. Clarke (novel, Peter Hyams (screenplay)",Nominated for 5 Oscars. Another 1 win & 3 nominations.,2010,PG,"40,224",6.8,movie,"Mystery, Sci-Fi, Thriller",07 Dec 1984,http://ia.media-imdb.com/images/M/MV5BMTkzOTk4NTcyOV5BMl5BanBnXkFtZTgwOTE4NjkzMTE@._V1_SX300.jpg,116 min,N/A,"English, Russian",USA
56fb965e71a0650fe43395fa,True,"Lucinda Dickey, Adolfo Quinones, Michael Chambers, Ben Lokey",tt0086998,"36,100,000",Joel Silberg,"Charles Parker (story, Allen DeBevoise (story, Charles Parker (screenplay, Allen DeBevoise (screenplay, Gerald Scaife (screenplay)",1 nomination.,Breakin',PG,"4,303",5.6,movie,"Comedy, Drama, Music",04 May 1984,http://ia.media-imdb.com/images/M/MV5BMTQzNTkwODIzNl5BMl5BanBnXkFtZTcwMTY2MzAwMQ@@._V1_SX300.jpg,90 min,N/A,English,USA
56fb965e71a0650fe43395fb,True,"Tom Hanks, Tawny Kitaen, Adrian Zmed, George Grizzard",tt0086927,"38,400,000",Neal Israel,"Bob Israel (story, Neal Israel (screenplay, Pat Proft (screenplay)",N/A,Bachelor Party,R,"27,861",6.3,movie,Comedy,29 Jun 1984,http://ia.media-imdb.com/images/M/MV5BMTgxMjMzNjcyN15BMl5BanBnXkFtZTcwNjg3ODIyMQ@@._V1_SX300.jpg,105 min,N/A,"English, Japanese",USA
56fb965e71a0650fe43395fc,True,"Arnold Schwarzenegger, Michael Biehn, Linda Hamilton, Paul Winfield",tt0088247,"38,400,000",James Cameron,"James Cameron, Gale Anne Hurd, William Wisher Jr. (additional dialogue)",5 wins & 6 nominations.,The Terminator,R,"575,339",8.1,movie,"Action, Sci-Fi",26 Oct 1984,http://ia.media-imdb.com/images/M/MV5BODE1MDczNTUxOV5BMl5BanBnXkFtZTcwMTA0NDQyNA@@._V1_SX300.jpg,107 min,83,"English, Spanish","UK, USA"
56fb965e71a0650fe43395fd,True,"Clint Eastwood, Burt Reynolds, Jane Alexander, Madeline Kahn",tt0087062,"38,300,000",Richard Benjamin,"Blake Edwards (story, Blake Edwards, Joseph Stinson",1 nomination.,City Heat,PG,"6,737",5.4,movie,"Action, Comedy, Crime",07 Dec 1984,http://ia.media-imdb.com/images/M/MV5BMjA5NTMzNjcxN15BMl5BanBnXkFtZTcwNjI4MTAwMQ@@._V1_SX300.jpg,93 min,N/A,English,USA
56fb965e71a0650fe43395fe,True,"Steve Martin, Lily Tomlin, Victoria Tennant, Madolyn Smith Osborne",tt0086873,,Carl Reiner,"Edwin Davis (novel, Henry Olek (adaptation, Phil Alden Robinson (screenplay)",Nominated for 2 Golden Globes. Another 2 wins.,All of Me,PG-13,"12,793",6.7,movie,"Comedy, Fantasy, Romance",21 Sep 1984,http://ia.media-imdb.com/images/M/MV5BMjI1OTU4MTM2M15BMl5BanBnXkFtZTgwNTU4NzgxMTE@._V1_SX300.jpg,93 min,N/A,English,USA
56fb965e71a0650fe43395ff,True,"Sally Field, Lindsay Crouse, Ed Harris, Amy Madigan",tt0087921,"34,700,000",Robert Benton,Robert Benton,Won 2 Oscars. Another 11 wins & 14 nominations.,Places in the Heart,PG,"7,426",7.3,movie,Drama,05 Oct 1984,http://ia.media-imdb.com/images/M/MV5BMTM4MDM4ODkxMl5BMl5BanBnXkFtZTYwMjYwOTQ5._V1_SX300.jpg,111 min,N/A,English,USA
56fb965e71a0650fe4339600,True,"Sam Waterston, Haing S. Ngor, John Malkovich, Julian Sands",tt0087553,"34,600,000",Roland Joffé,Bruce Robinson (screenplay),Won 3 Oscars. Another 24 wins & 22 nominations.,The Killing Fields,R,"41,126",7.9,movie,"Drama, History, War",01 Feb 1985,http://ia.media-imdb.com/images/M/MV5BMjE3OTEwMjk2Nl5BMl5BanBnXkFtZTcwOTgwNTMyMQ@@._V1_SX300.jpg,141 min,N/A,"English, French, Khmer, Russian",UK
56fb965e71a0650fe4339601,True,"Arnold Schwarzenegger, Grace Jones, Wilt Chamberlain, Mako",tt0087078,"26,400,000",Richard Fleischer,"Robert E. Howard (character, Roy Thomas (story, Gerry Conway (story, Stanley Mann (screenplay)",1 win & 3 nominations.,Conan the Destroyer,PG,"60,240",5.8,movie,"Action, Adventure, Fantasy",29 Jun 1984,http://ia.media-imdb.com/images/M/MV5BMTM2NTEwODA3M15BMl5BanBnXkFtZTcwNTk2NjEzNA@@._V1_SX300.jpg,103 min,N/A,English,USA
56fb965e71a0650fe4339602,True,"Francesca Annis, Leonardo Cimino, Brad Dourif, José Ferrer",tt0087182,"27,400,000",David Lynch,"Frank Herbert (novel, David Lynch (screenplay)",Nominated for 1 Oscar. Another 2 wins & 4 nominations.,Dune,PG-13,"95,099",6.6,movie,"Action, Adventure, Sci-Fi",14 Dec 1984,http://ia.media-imdb.com/images/M/MV5BNTkxMjkxNzg3Nl5BMl5BanBnXkFtZTgwNjUyMDI3NjE@._V1_SX300.jpg,137 min,N/A,"English, Italian",USA
56fb965e71a0650fe4339603,True,"Jeff Bridges, Karen Allen, Charles Martin Smith, Richard Jaeckel",tt0088172,"28,700,000",John Carpenter,"Bruce A. Evans, Raynold Gideon",Nominated for 1 Oscar. Another 1 win & 5 nominations.,Starman,PG,"32,229",7.0,movie,"Adventure, Drama, Romance",14 Dec 1984,http://ia.media-imdb.com/images/M/MV5BODg5ODI0NzM5M15BMl5BanBnXkFtZTgwNDk5MjQxMDE@._V1_SX300.jpg,115 min,71,English,USA
56fb965e71a0650fe4339604,True,"Kay E. Kuter, Dan Mason, Lance Guest, Dan O'Herlihy",tt0087597,,Nick Castle,Jonathan R. Betuel,4 nominations.,The Last Starfighter,PG,"28,211",6.7,movie,"Action, Adventure, Sci-Fi",13 Jul 1984,http://ia.media-imdb.com/images/M/MV5BMTk4NDY2NTA2MV5BMl5BanBnXkFtZTYwNjI2Mjg4._V1_SX300.jpg,101 min,N/A,English,USA
56fb965e71a0650fe4339605,True,"Burt Reynolds, Frank Sinatra, Jamie Farr, Dom DeLuise",tt0087032,"28,100,000",Hal Needham,"Brock Yates (characters creator, Hal Needham, Albert S. Ruddy, Harvey Miller",1 win & 8 nominations.,Cannonball Run II,PG,"11,411",4.8,movie,"Action, Comedy",29 Jun 1984,http://ia.media-imdb.com/images/M/MV5BMjUwMzQzOTA0M15BMl5BanBnXkFtZTYwMTkwMzc5._V1_SX300.jpg,108 min,N/A,English,"USA, Hong Kong"
56fb965e71a0650fe4339606,True,"Nick Nolte, JoBeth Williams, Judd Hirsch, Ralph Macchio",tt0088242,,Arthur Hiller,W.R. McKinney,N/A,Teachers,R,"3,042",6.0,movie,"Comedy, Drama",05 Oct 1984,http://ia.media-imdb.com/images/M/MV5BMTg4OTg4ODI2MF5BMl5BanBnXkFtZTcwOTM2NzI5NA@@._V1_SX300.jpg,107 min,N/A,English,USA
56fb965e71a0650fe4339607,True,"Judy Davis, Victor Banerjee, Peggy Ashcroft, James Fox",tt0087892,"26,400,000",David Lean,"E.M. Forster (by, E.M. Forster (based on the novel by, Santha Rama Rau (and the play by, David Lean (screenplay)",Won 2 Oscars. Another 19 wins & 26 nominations.,A Passage to India,PG,"12,586",7.4,movie,"Adventure, Drama, History",01 Feb 1985,http://ia.media-imdb.com/images/M/MV5BMjI4MzMzMTUzMV5BMl5BanBnXkFtZTgwNzAzMDUxMDE@._V1_SX300.jpg,164 min,N/A,"English, Hindi","UK, USA"
56fb965e71a0650fe4339608,True,"Goldie Hawn, Chris Sarandon, Richard Romanus, Andre Gregory",tt0087951,"26,300,000",Herbert Ross,"Buck Henry (screenplay, Charles Shyer (story, Nancy Meyers (story, Harvey Miller (story)",N/A,Protocol,PG,"3,380",5.4,movie,Comedy,21 Dec 1984,http://ia.media-imdb.com/images/M/MV5BMjEwOTY0MTUzNl5BMl5BanBnXkFtZTcwMDkxNjEyMQ@@._V1_SX300.jpg,96 min,N/A,English,USA
56fb965e71a0650fe4339609,True,"Richard Gere, Gregory Hines, Diane Lane, Lonette McKee",tt0087089,"25,900,000",Francis Ford Coppola,"William Kennedy (screenplay, Francis Ford Coppola (screenplay, William Kennedy (story, Francis Ford Coppola (story, Mario Puzo (story, Jim Haskins (pictorial history \",Nominated for 2 Oscars. Another 1 win & 6 nominations.,The Cotton Club,R,"12,484",6.5,movie,"Crime, Drama, Music",14 Dec 1984,http://ia.media-imdb.com/images/M/MV5BMTU5ODAyNzA4OV5BMl5BanBnXkFtZTcwNzYwNTIzNA@@._V1_SX300.jpg,127 min,N/A,"English, Italian",USA
56fb965e71a0650fe433960a,True,"Jim Henson, Frank Oz, Dave Goelz, Steve Whitmire",tt0087755,,Frank Oz,"Tom Patchett (story, Jay Tarses (story, Frank Oz (screenplay, Tom Patchett (screenplay, Jay Tarses (screenplay)",Nominated for 1 Oscar. Another 2 nominations.,The Muppets Take Manhattan,G,"14,795",6.9,movie,"Comedy, Drama, Family",13 Jul 1984,http://ia.media-imdb.com/images/M/MV5BOTc4Mjk4MDA0OV5BMl5BanBnXkFtZTcwNDkxMTUyMQ@@._V1_SX300.jpg,94 min,N/A,English,USA
56fb965e71a0650fe433960b,True,"John Saxon, Ronee Blakley, Heather Langenkamp, Amanda Wyss",tt0087800,"26,505,000",Wes Craven,Wes Craven,2 wins & 3 nominations.,A Nightmare on Elm Street,R,"143,632",7.5,movie,Horror,16 Nov 1984,http://ia.media-imdb.com/images/M/MV5BMTk0NDI3NTEwMV5BMl5BanBnXkFtZTgwNjgwNDgwNzE@._V1_SX300.jpg,91 min,78,English,USA
56fb965e71a0650fe433960c,True,"Gene Wilder, Charles Grodin, Joseph Bologna, Judith Ivey",tt0088414,"25,300,000",Gene Wilder,"Jean-Loup Dabadie (screenplay, Yves Robert (screenplay, Gene Wilder",Won 1 Oscar. Another 1 win & 1 nomination.,The Woman in Red,PG-13,"9,607",5.8,movie,"Comedy, Romance",15 Aug 1984,http://ia.media-imdb.com/images/M/MV5BMTUwOTE5NDk2NV5BMl5BanBnXkFtZTYwODY4NTk4._V1_SX300.jpg,87 min,N/A,English,USA
56fb965e71a0650fe433960d,True,"Robin Williams, Maria Conchita Alonso, Cleavant Derricks, Alejandro Rey",tt0087747,"25,100,000",Paul Mazursky,"Paul Mazursky, Leon Capetanos",Nominated for 1 Golden Globe. Another 1 nomination.,Moscow on the Hudson,R,"8,516",6.5,movie,"Comedy, Drama, Romance",06 Apr 1984,http://ia.media-imdb.com/images/M/MV5BMjU4NTQ1NTQ4OF5BMl5BanBnXkFtZTcwMjAwNDkxMQ@@._V1_SX300.jpg,115 min,N/A,"English, Russian",USA
56fb965e71a0650fe433960e,True,"Matt Dillon, Hector Elizondo, Molly McCarthy, Martha Gehman",tt0087265,,Garry Marshall,"Neal Marshall (story, Garry Marshall",N/A,The Flamingo Kid,PG-13,"3,841",6.2,movie,"Comedy, Drama, Romance",21 Dec 1984,http://ia.media-imdb.com/images/M/MV5BMTQ2ODIwODU2Nl5BMl5BanBnXkFtZTcwNDU4OTAyMQ@@._V1_SX300.jpg,100 min,N/A,English,USA
56fb965e71a0650fe433960f,True,"Molly Ringwald, Justin Henry, Michael Schoeffling, Haviland Morris",tt0088128,"20,500,000",John Hughes,John Hughes,2 wins & 1 nomination.,Sixteen Candles,PG,"70,498",7.2,movie,"Comedy, Romance",04 May 1984,http://ia.media-imdb.com/images/M/MV5BMTgzNTkxMTkxMl5BMl5BanBnXkFtZTgwMjE3NjkzMTE@._V1_SX300.jpg,93 min,57,English,USA
56fb965e71a0650fe4339610,True,"Chuck Norris, M. Emmet Walsh, David Tress, Lenore Kasdorf",tt0087727,"22,812,500",Joseph Zito,"Arthur Silver (characters, Larry Levinson (characters, Steve Bing (characters, James Bruner (screenplay, John Crowther (story, Lance Hool (story)",N/A,Missing in Action,R,"10,117",5.3,movie,"Action, Adventure, Drama",16 Nov 1984,http://ia.media-imdb.com/images/M/MV5BODAyNTc5ODk0MV5BMl5BanBnXkFtZTcwNzkzNzA2NA@@._V1_SX300.jpg,101 min,N/A,"English, Vietnamese",USA
56fb965e71a0650fe4339611,True,"Howard E. Rollins Jr., Adolph Caesar, Art Evans, David Alan Grier",tt0088146,"22,100,000",Norman Jewison,"Charles Fuller (screenplay, Charles Fuller (play)",Nominated for 3 Oscars. Another 5 wins & 6 nominations.,A Soldier's Story,PG,"6,373",7.2,movie,"Crime, Drama, Mystery",02 Nov 1984,http://ia.media-imdb.com/images/M/MV5BMTI3NTEwMjgxNF5BMl5BanBnXkFtZTcwNjgyMTkyMQ@@._V1_SX300.jpg,101 min,N/A,English,USA
56fb965e71a0650fe4339612,True,"Rachel Ward, Jeff Bridges, James Woods, Alex Karras",tt0086859,"25,100,000",Taylor Hackford,"Eric Hughes, Daniel Mainwaring",Nominated for 1 Oscar. Another 2 wins & 2 nominations.,Against All Odds,R,"7,845",5.9,movie,"Action, Adventure, Crime",02 Mar 1984,http://ia.media-imdb.com/images/M/MV5BMTAyNjQ3MzI3MDFeQTJeQWpwZ15BbWU3MDAwMDIwMzE@._V1_SX300.jpg,128 min,42,English,USA
56fb965e71a0650fe4339613,True,"George Burns, Ted Wass, Ron Silver, Roxanne Hart",tt0087835,,Paul Bogart,"Andrew Bergman, Avery Corman (novel)",1 nomination.,"Oh, God! You Devil",PG,"1,812",5.3,movie,"Comedy, Fantasy",09 Nov 1984,http://ia.media-imdb.com/images/M/MV5BMjE2MjcwOTIwMF5BMl5BanBnXkFtZTcwNDM0NDcyMQ@@._V1_SX300.jpg,97 min,N/A,English,USA
56fb965e71a0650fe4339614,True,"Sylvester Stallone, Dolly Parton, Richard Farnsworth, Tim Thomerson",tt0088001,,Bob Clark,"Phil Alden Robinson (story, Phil Alden Robinson (screenplay, Sylvester Stallone (screenplay)",2 wins & 8 nominations.,Rhinestone,PG,"5,530",3.6,movie,"Comedy, Music",22 Jun 1984,http://ia.media-imdb.com/images/M/MV5BMTkwMTg5NzMxN15BMl5BanBnXkFtZTcwMjA3MDgyMQ@@._V1_SX300.jpg,111 min,N/A,English,USA
56fb965e71a0650fe4339615,True,"D.W. Brown, Peter Ellenstein, Patrick Houser, Chip McAllister",tt0088385,"21,058,000",Lawrence Bassoff,Lawrence Bassoff,N/A,Weekend Pass,R,327,3.7,movie,Comedy,03 Feb 1984,http://ia.media-imdb.com/images/M/MV5BMTQxNzI5OTk1N15BMl5BanBnXkFtZTcwMjc4NTczMQ@@._V1_SX300.jpg,88 min,N/A,English,USA
56fb965e71a0650fe4339616,True,"Val Kilmer, Lucy Gutteridge, Peter Cushing, Jeremy Kemp",tt0088286,,"Jim Abrahams, David Zucker, Jerry Zucker","Jim Abrahams, David Zucker, Jerry Zucker, Martyn Burke",N/A,Top Secret!,PG,"45,075",7.2,movie,Comedy,08 Jun 1984,http://ia.media-imdb.com/images/M/MV5BMTU1NDQ3NDAyNF5BMl5BanBnXkFtZTcwOTY0NTMyMQ@@._V1_SX300.jpg,90 min,N/A,"English, German, Yiddish","USA, UK"
56fb965e71a0650fe4339617,True,"David Naughton, Patrick Houser, Tracy Smith, John Patrick Reger",tt0087425,"20,307,325",Peter Markle,Mike Marvin,N/A,Hot Dog... The Movie,R,"2,291",4.7,movie,"Comedy, Romance, Sport",13 Jan 1984,http://ia.media-imdb.com/images/M/MV5BMjE0MDUzNzAzOV5BMl5BanBnXkFtZTcwMjcyODE0NA@@._V1_SX300.jpg,96 min,N/A,English,USA
56fb965e71a0650fe4339618,True,"Barret Oliver, Gerald McRaney, Chris Eastman, Darryl Cooksey",tt0088323,,Wolfgang Petersen,"Wolfgang Petersen (screenplay, Herman Weigel (screenplay, Michael Ende (novel, Robert Easton (additional dialogue)",5 wins & 7 nominations.,The NeverEnding Story,PG,"96,334",7.4,movie,"Adventure, Drama, Family",20 Jul 1984,http://ia.media-imdb.com/images/M/MV5BMTI3MDA3NTQ0MF5BMl5BanBnXkFtZTcwNDEwMDMyMQ@@._V1_SX300.jpg,102 min,46,English,"West Germany, USA"
56fb965e71a0650fe4339619,True,"Dudley Moore, Eddie Murphy, Kate Capshaw, George Dzundza",tt0086955,,Willard Huyck,"Robert Grossbach (novel, Gloria Katz, Willard Huyck",1 nomination.,Best Defense,R,"4,588",3.5,movie,"Comedy, War",20 Jul 1984,http://ia.media-imdb.com/images/M/MV5BMjAzMjM5NzY1Nl5BMl5BanBnXkFtZTcwMTU4ODUyMQ@@._V1_SX300.jpg,94 min,N/A,English,USA
56fb965e71a0650fe433961a,True,"Michael Caine, Joseph Bologna, Valerie Harper, Michelle Johnson",tt0159539,"18,600,000",Stanley Donen,"Charlie Peters (screenplay, Larry Gelbart (screenplay)",1 nomination.,Blame It on Rio,R,"7,874",5.7,movie,"Comedy, Romance",17 Feb 1984,http://ia.media-imdb.com/images/M/MV5BMzg1NTYzODMzNF5BMl5BanBnXkFtZTcwNDYwMTUyMQ@@._V1_SX300.jpg,100 min,N/A,English,USA
56fb965e71a0650fe433961b,True,"Tom Selleck, Jane Seymour, Lauren Hutton, Bob Hoskins",tt0087589,"17,500,000",Roger Young,David Taylor,N/A,Lassiter,R,"1,534",5.9,movie,"Action, Crime, Drama",17 Feb 1984,http://ia.media-imdb.com/images/M/MV5BOTY1MDc5NDI1M15BMl5BanBnXkFtZTcwOTkzMTYyMQ@@._V1_SX300.jpg,100 min,N/A,English,USA
56fb965e71a0650fe433961c,True,"Cliff Gorman, Susan Tyrrell, Dick Shawn, Rory Calhoun",tt0086896,,Robert Vincent O'Neill,"Robert Vincent O'Neill, Joseph Michael Cala",1 win.,Angel,R,"1,745",5.6,movie,"Action, Crime, Thriller",13 Jan 1984,http://ia.media-imdb.com/images/M/MV5BMTY0ODUyMDcwMF5BMl5BanBnXkFtZTcwMjUwNjAzMQ@@._V1_SX300.jpg,94 min,N/A,English,USA
56fb965e71a0650fe433961d,True,"Michael Keaton, Joe Piscopo, Marilu Henner, Maureen Stapleton",tt0087507,,Amy Heckerling,"Harry Colomby, Jeff Harris, Bernie Kukoff, Norman Steinberg",N/A,Johnny Dangerously,PG-13,"10,751",6.4,movie,"Action, Comedy, Crime",21 Dec 1984,http://ia.media-imdb.com/images/M/MV5BMTYxMDYzMzk4NV5BMl5BanBnXkFtZTcwMDkwNTMyMQ@@._V1_SX300.jpg,90 min,N/A,English,USA
56fb965e71a0650fe433961e,True,"David Keith, Drew Barrymore, Freddie Jones, Heather Locklear",tt0087262,"15,100,000",Mark L. Lester,"Stephen King (novel, Stanley Mann",2 nominations.,Firestarter,R,"22,179",6.0,movie,"Action, Horror, Sci-Fi",11 May 1984,http://ia.media-imdb.com/images/M/MV5BMTk2Mjk3MTI4NF5BMl5BanBnXkFtZTcwOTE3ODMyMQ@@._V1_SX300.jpg,114 min,N/A,English,USA
56fb965e71a0650fe433961f,True,"Rae Dawn Chong, Guy Davis, Jon Chardiet, Leon W. Grant",tt0086946,,Stan Lathan,"Steven Hager (story, Andrew Davis (screenplay, David Gilbert (screenplay, Paul Golding (screenplay)",N/A,Beat Street,PG,"2,495",6.5,movie,"Drama, Music",08 Jun 1984,http://ia.media-imdb.com/images/M/MV5BMTM4NTg2NDA3N15BMl5BanBnXkFtZTcwODM0NjgyNA@@._V1_SX300.jpg,105 min,N/A,English,USA
56fb965e71a0650fe4339620,True,"Lucinda Dickey, Adolfo Quinones, Michael Chambers, Susie Coelho",tt0086999,"6,800,000",Sam Firstenberg,"Charles Parker (characters, Allen DeBevoise (characters, Jan Ventura, Julie Reichert",N/A,Breakin' 2: Electric Boogaloo,PG,"2,701",4.9,movie,"Comedy, Drama, Musical",21 Dec 1984,http://ia.media-imdb.com/images/M/MV5BMjI3NzgwMjM4M15BMl5BanBnXkFtZTcwMDk1NjgyNA@@._V1_SX300.jpg,94 min,N/A,English,USA
56fb965e71a0650fe4339621,True,"Peter Horton, Linda Hamilton, R.G. Armstrong, John Franklin",tt0087050,"14,600,000",Fritz Kiersch,"Stephen King (short story, George Goldsmith (screenplay)",1 win & 3 nominations.,Children of the Corn,R,"33,420",5.6,movie,Horror,09 Mar 1984,http://ia.media-imdb.com/images/M/MV5BMTM2NzU0Mzg2N15BMl5BanBnXkFtZTcwMDI1ODYyMQ@@._V1_SX300.jpg,92 min,N/A,English,USA
56fb965e71a0650fe4339622,True,"Robert Beltran, Catherine Mary Stewart, Kelli Maroney, Sharon Farrell",tt0087799,,Thom Eberhardt,Thom Eberhardt,1 nomination.,Night of the Comet,PG-13,"12,444",6.4,movie,"Comedy, Horror, Sci-Fi",16 Nov 1984,http://ia.media-imdb.com/images/M/MV5BMTY5NDIwNDA1NV5BMl5BanBnXkFtZTcwOTUxOTM2NA@@._V1_SX300.jpg,95 min,N/A,English,USA
56fb965e71a0650fe4339623,True,"Faye Dunaway, Helen Slater, Peter O'Toole, Hart Bochner",tt0088206,"13,600,000",Jeannot Szwarc,David Odell (screenplay),3 nominations.,Supergirl,PG,"13,648",4.3,movie,"Action, Adventure, Fantasy",21 Nov 1984,http://ia.media-imdb.com/images/M/MV5BMTkzMjY2NDkyN15BMl5BanBnXkFtZTYwMzI2OTA5._V1_SX300.jpg,105 min,N/A,English,"UK, USA"
56fb965e71a0650fe4339624,True,"Robert Urich, Mary Crosby, Michael D. Roberts, Anjelica Huston",tt0087451,,Stewart Raffill,"Stewart Raffill, Stanford Sherman",N/A,The Ice Pirates,PG,"7,563",5.7,movie,"Action, Adventure, Comedy",16 Mar 1984,http://ia.media-imdb.com/images/M/MV5BOTcxMDk4OTUzNF5BMl5BanBnXkFtZTcwNDQ0NDcyMQ@@._V1_SX300.jpg,91 min,N/A,English,USA
56fb965e71a0650fe4339625,True,"Charles Bronson, Theresa Saldana, Joseph Maher, José Ferrer",tt0087222,,J. Lee Thompson,"R. Lance Hill (novel, R. Lance Hill (screenplay, John Crowther (screenplay)",N/A,The Evil That Men Do,R,"2,191",5.9,movie,"Action, Drama, Thriller",21 Sep 1984,http://ia.media-imdb.com/images/M/MV5BMTk1NzIwNTY5N15BMl5BanBnXkFtZTcwOTMzMDQyMQ@@._V1_SX300.jpg,90 min,N/A,English,"Mexico, USA, UK"
56fb965e71a0650fe4339626,True,"Ryan O'Neal, Shelley Long, Drew Barrymore, Sam Wanamaker",tt0087482,"12,400,000",Charles Shyer,"Nancy Meyers, Charles Shyer",Nominated for 2 Golden Globes. Another 1 nomination.,Irreconcilable Differences,PG,"2,271",5.8,movie,"Comedy, Drama, Romance",28 Sep 1984,http://ia.media-imdb.com/images/M/MV5BMTU5NzI4MDUyMF5BMl5BanBnXkFtZTcwNDkxNzkzMg@@._V1_SX300.jpg,113 min,N/A,English,USA
