_id,Response,Actors,imdbID,Box_office,Director,Writer,Awards,Title,Rated,imdbVotes,imdbRating,Type,Genre,Released,Poster,Runtime,Metascore,Language,Country
56fb965e71a0650fe433966c,True,"Willie Nelson, Kris Kristofferson, Melinda Dillon, Rip Torn",tt0088153,,Alan Rudolph,Bud Shrake,Nominated for 1 Oscar. Another 1 nomination.,Songwriter,R,362,6.4,movie,"Drama, Music",14 Oct 1984,http://ia.media-imdb.com/images/M/MV5BMTAzOTY4OTkxODVeQTJeQWpwZ15BbWU3MDYwMzg1MjE@._V1_SX300.jpg,94 min,N/A,English,USA
56fb965e71a0650fe433966d,True,"Robert Hays, Ron Travis, M. Emmet Walsh, John Gielgud",tt0088046,,Rob Cohen,"Larry Cohen (story, Rob Cohen (story, John Byrum (story, Rob Cohen (screenplay, John Byrum (screenplay)",N/A,Scandalous,PG,191,4.4,movie,Comedy,20 Jan 1984,http://ia.media-imdb.com/images/M/MV5BMTMyMTM3Mjg2MF5BMl5BanBnXkFtZTcwODQyMTM4NA@@._V1_SX300.jpg,92 min,N/A,English,"UK, USA"
56fb965e71a0650fe433966e,True,"John Shea, Kate Capshaw, Josh Mostel, Jim Borrelli",tt0088405,,Armyan Bernstein,Armyan Bernstein,1 win.,Windy City,R,184,6.5,movie,Drama,21 Sep 1984,N/A,103 min,N/A,English,USA
56fb965e71a0650fe433966f,True,"Robert Duvall, Jason Presson, Glenn Close, Susan Rinell",tt0088176,,Christopher Cain,Gina Berriault (screenplay),2 nominations.,The Stone Boy,PG,575,6.8,movie,Drama,04 Apr 1984,http://ia.media-imdb.com/images/M/MV5BMTk0ODUwNjI3Nl5BMl5BanBnXkFtZTgwNTc0ODk1MDE@._V1_SX300.jpg,91 min,N/A,English,USA
56fb965e71a0650fe4339670,True,"John Hurt, Gregory Jones, Mick Dillon, Ann Bell",tt0085320,,John Irvin,"Bob Champion (book, Jonathan Powell (book, Evan Jones (screenplay)",1 win & 1 nomination.,Champions,PG,466,6.5,movie,"Biography, Drama, Romance",20 Apr 1984,http://ia.media-imdb.com/images/M/MV5BMjEyMDc4MjA1Ml5BMl5BanBnXkFtZTcwNzA4NjIyMQ@@._V1_SX300.jpg,106 min,N/A,English,UK
56fb965e71a0650fe4339671,True,"Gregory Harrison, Arkie Whiteley, Bill Kerr, Chris Haywood",tt0087981,"150,000",Russell Mulcahy,"Peter Brennan (novel, Everett De Roche",3 wins & 5 nominations.,Razorback,R,"3,584",6.0,movie,"Horror, Thriller",16 Nov 1984,http://ia.media-imdb.com/images/M/MV5BMTYwNzM2NTQyOF5BMl5BanBnXkFtZTcwODE2NDMzMQ@@._V1_SX300.jpg,95 min,N/A,English,Australia
56fb965e71a0650fe4339672,True,"Donald Sutherland, Jack Warden, Sean Penn, Wallace Shawn",tt0087096,,Louis Malle,Jeffrey Alan Fiskin (screenplay),1 nomination.,Crackers,PG,893,5.1,movie,"Adventure, Comedy, Crime",17 Feb 1984,http://ia.media-imdb.com/images/M/MV5BMTc3ODEyNzUxNF5BMl5BanBnXkFtZTcwMjUwMzk1Mw@@._V1_SX300.jpg,91 min,N/A,English,USA
56fb965e71a0650fe4339673,True,"Harry Dean Stanton, Emilio Estevez, Tracey Walter, Olivia Barash",tt0087995,,Alex Cox,Alex Cox,2 wins & 3 nominations.,Repo Man,R,"24,573",6.9,movie,"Comedy, Crime, Sci-Fi",02 Mar 1984,http://ia.media-imdb.com/images/M/MV5BMTU3MTI3MjkxOF5BMl5BanBnXkFtZTcwNjQyNzEzMQ@@._V1_SX300.jpg,92 min,75,"English, Spanish",USA
56fb965e71a0650fe4339674,True,David Bradshaw,tt0087220,,N/A,N/A,N/A,Eureka Stockade,N/A,32,7.5,movie,Drama,27 Mar 1984,N/A,N/A,N/A,English,Australia
