_id,Title,Awards,Metascore,Country,Runtime,Rated,Director,imdbID,imdbVotes,Language,Actors,Poster,Type,Writer,Genre,Response,Released,imdbRating,Box_office
5707157a71a065165c8c3add,Pyare Mohan,N/A,N/A,India,N/A,N/A,"Indra Kumar, Kookie V. Gulati",tt0461323,589,Hindi,"Fardeen Khan, Vivek Oberoi, Esha Deol, Amrita Rao",http://ia.media-imdb.com/images/M/MV5BMTQ0NDYyNjIxMF5BMl5BanBnXkFtZTgwNDc1MDA2MDE@._V1_SX300.jpg,movie,"Milap Zaveri (story, Tushar Hiranandani (story, Milap Zaveri (screenplay, Tushar Hiranandani (screenplay, Milap Zaveri (dialogue)","Comedy, Drama, Romance",True,21 Apr 2006,3.2,
5707157a71a065165c8c3ade,Cocaine Cowboys,N/A,59,USA,118 min,R,Billy Corben,tt0380268,"10,167",English,"Jon Roberts, Al Sunshine, Sam Burstyn, Mickey Munday",http://ia.media-imdb.com/images/M/MV5BMTIzMjg0MTE0NV5BMl5BanBnXkFtZTcwNTEzMzkzMQ@@._V1_SX300.jpg,movie,N/A,"Documentary, Crime",True,23 Nov 2007,7.9,"148,872"
5707157a71a065165c8c3adf,Jonestown: The Life and Death of Peoples Temple,3 nominations.,79,USA,86 min,N/A,Stanley Nelson,tt0762111,"3,666",English,"Rebecca Moore, Janet Shular, Tim Carter, Stanley Clayton",http://ia.media-imdb.com/images/M/MV5BMjA1NDg4NjUzM15BMl5BanBnXkFtZTcwMTk3NDI0MQ@@._V1_SX300.jpg,movie,"Marcia Smith (story, Marcia Smith (teleplay, Noland Walker (teleplay)","Documentary, History",True,25 Apr 2006,7.9,
5707157a71a065165c8c3ae0,Wild Duck Season,2 wins.,N/A,Poland,19 min,N/A,Julia Ruszkiewicz,tt3174330,N/A,N/A,"Marian Dziedziel, Ewa Gorzelak, Kamil Grenda, Adam Kamien",N/A,movie,Julia Ruszkiewicz,"Short, Drama",True,N/A,N/A,
5707157a71a065165c8c3ae1,The Bubble,11 wins & 3 nominations.,61,Israel,117 min,UNRATED,Eytan Fox,tt0476643,"4,569","Hebrew, Arabic, English","Ohad Knoller, Yousef 'Joe' Sweid, Daniella Wircer, Alon Friedman",http://ia.media-imdb.com/images/M/MV5BMTIyMDgxOTk0MF5BMl5BanBnXkFtZTcwOTkwODM1MQ@@._V1_SX300.jpg,movie,"Gal Uchovsky (screenplay, Eytan Fox (screenplay, Martin Sherman (excerpt from the play 'Bent\","Comedy, Drama, Romance",True,07 Sep 2007,7.4,"155,972"
5707157a71a065165c8c3ae2,Once in a Lifetime: The Extraordinary Story of the New York Cosmos,1 nomination.,67,"UK, USA",97 min,PG-13,"Paul Crowder, John Dower",tt0489247,"1,268",English,"Ahmet Ertegun, Nesuhi Ertegün, Matt Dillon, Clive Toye",http://ia.media-imdb.com/images/M/MV5BMTYyMjc2MDE1OV5BMl5BanBnXkFtZTcwODAwNzMzMQ@@._V1_SX300.jpg,movie,"John Dower (story, Mark Monroe (screenplay, Mark Monroe (story)","Documentary, Sport",True,07 Jul 2006,7.3,"144,431"
5707157a71a065165c8c3ae3,Haven,N/A,N/A,UK,5 min,N/A,George Burt,tt1548255,N/A,English,Thomas Thoroe,N/A,movie,"George Burt, Hampus Myer, Andrew Niblo","Short, Drama",True,N/A,N/A,
5707157a71a065165c8c3ae4,How to Go Out on a Date in Queens,N/A,N/A,USA,90 min,R,Michelle Danner,tt0270417,340,English,"Jason Alexander, Ruth Barrie, Carlos M. Castillón, Cliff Bemis",http://ia.media-imdb.com/images/M/MV5BODgzMTMyNzY2Ml5BMl5BanBnXkFtZTcwODg1MzMzMQ@@._V1_SX300.jpg,movie,"Richard Vetere (play, Richard Vetere (screenplay)","Comedy, Romance",True,28 Jul 2006,4.5,
5707157a71a065165c8c3ae5,What the Bleep!?: Down the Rabbit Hole,N/A,45,USA,156 min,N/A,"William Arntz, Betsy Chasse, Mark Vicente",tt0499596,"2,173",English,"Marlee Matlin, Elaine Hendrix, Barry Newman, Armin Shimerman",http://ia.media-imdb.com/images/M/MV5BMTU1NDE4MjY0Ml5BMl5BanBnXkFtZTcwMDMyNDIzMQ@@._V1_SX300.jpg,movie,N/A,"Documentary, Drama",True,23 Mar 2006,6.5,"135,706"
5707157a71a065165c8c3ae6,Clean,N/A,N/A,Canada,71 min,N/A,Alexandre Michaud,tt0844289,63,English,"Marco Calliari, Sebastien Croteau, Martin Dubreuil, Éric Therrien",http://ia.media-imdb.com/images/M/MV5BMTczOTM2MTgyMl5BMl5BanBnXkFtZTgwODQ5MTg5NTE@._V1_SX300.jpg,movie,Alexandre Michaud,Horror,True,N/A,4.5,
5707157a71a065165c8c3ae7,Stolen,N/A,N/A,USA,N/A,N/A,Massimo Messina,tt2954078,N/A,English,Ryan Festge,N/A,movie,Don Festge,"Short, Thriller",True,28 Apr 2006,N/A,
5707157a71a065165c8c3ae8,Edmond,N/A,N/A,UK,N/A,N/A,Charles H. Joslain,tt5351480,N/A,French,N/A,N/A,movie,Charles H. Joslain,"Short, Drama",True,19 Jul 2006,N/A,
5707157a71a065165c8c3ae9,Making 'Game 6',N/A,N/A,USA,15 min,N/A,Michael Fiore,tt1138454,N/A,English,"Griffin Dunne, Ari Graynor, Bill Groom, Michael Hoffman",N/A,movie,N/A,Short,True,23 May 2006,N/A,
5707157a71a065165c8c3aea,The Groomsmen,N/A,57,USA,98 min,R,Edward Burns,tt0455958,"3,904",English,"Edward Burns, Heather Burns, John Leguizamo, Matthew Lillard",http://ia.media-imdb.com/images/M/MV5BMTcyOTUzNDA1M15BMl5BanBnXkFtZTcwMDIxNjQzMQ@@._V1_SX300.jpg,movie,Edward Burns,"Comedy, Drama, Music",True,22 Sep 2006,6.2,
5707157a71a065165c8c3aeb,Flannel Pajamas,1 nomination.,49,USA,124 min,R,Jeff Lipsky,tt0432290,810,English,"Justin Kirk, Julianne Nicholson, Rebecca Schull, Jamie Harrold",http://ia.media-imdb.com/images/M/MV5BMTMxMzQzMTYxN15BMl5BanBnXkFtZTcwMTc4OTMzMQ@@._V1_SX300.jpg,movie,Jeff Lipsky,Romance,True,22 Jan 2006,5.9,"123,301"
5707157a71a065165c8c3aec,Climates,12 wins & 7 nominations.,72,"Turkey, France",101 min,UNRATED,Nuri Bilge Ceylan,tt0498097,"7,897",Turkish,"Ebru Ceylan, Nuri Bilge Ceylan, Nazan Kesal, Mehmet Eryilmaz",http://ia.media-imdb.com/images/M/MV5BMTk4NDAzMzEyNV5BMl5BanBnXkFtZTcwOTY1NTc0MQ@@._V1_SX300.jpg,movie,Nuri Bilge Ceylan,Drama,True,20 Oct 2006,7.3,"119,958"
5707157a71a065165c8c3aed,Come Early Morning,2 wins & 1 nomination.,64,USA,97 min,R,Joey Lauren Adams,tt0457308,"2,299",English,"Ashley Judd, Jason T. Davis, Richard Lee Crow, Laura Prepon",http://ia.media-imdb.com/images/M/MV5BMjEzMDc0NjI5Nl5BMl5BanBnXkFtZTcwOTExMjA0MQ@@._V1_SX300.jpg,movie,Joey Lauren Adams,"Drama, Romance",True,31 Aug 2007,6.2,"117,560"
5707157a71a065165c8c3aee,Shaadi Se Pehle,N/A,N/A,India,122 min,N/A,Satish Kaushik,tt0489560,583,Hindi,"Akshaye Khanna, Ayesha Takia, Mallika Sherawat, Sunil Shetty",http://ia.media-imdb.com/images/M/MV5BMTQ0MzYwNzAzM15BMl5BanBnXkFtZTcwNzkyMjY0MQ@@._V1_SX300.jpg,movie,"Sanjay Chhel, Satish Kaushik (screenplay)","Comedy, Musical, Romance",True,07 Apr 2006,4.0,
5707157a71a065165c8c3aef,Al Franken: God Spoke,N/A,49,USA,90 min,N/A,"Nick Doob, Chris Hegedus",tt0799916,444,English,"Al Franken, Franni Bryson, Katherine Lanpher, Billy Kimball",http://ia.media-imdb.com/images/M/MV5BMTM0MTk5NTcxOF5BMl5BanBnXkFtZTcwNzQ4OTI0MQ@@._V1_SX300.jpg,movie,N/A,Documentary,True,30 Apr 2006,6.6,"102,990"
5707157a71a065165c8c3af0,Black Gold,1 win & 3 nominations.,69,"UK, USA",78 min,UNRATED,"Marc Francis, Nick Francis",tt0492447,758,"Amharic, Italian, English",N/A,http://ia.media-imdb.com/images/M/MV5BMjAyNjUzMDcyM15BMl5BanBnXkFtZTcwMjI1NzI0Mg@@._V1_SX300.jpg,movie,N/A,Documentary,True,08 Jun 2007,7.2,"93,477"
5707157a71a065165c8c3af1,America: Freedom to Fascism,N/A,43,USA,95 min,N/A,Aaron Russo,tt0772153,"2,289",English,"Aaron Russo, John Turner, Joe Banister, Sherry Peel Jackson",http://ia.media-imdb.com/images/M/MV5BMTQ3NzkxMzA4MF5BMl5BanBnXkFtZTcwODIzNTQzMQ@@._V1_SX300.jpg,movie,Aaron Russo,Documentary,True,28 Jul 2006,8.1,"61,200"
5707157a71a065165c8c3af2,Color of the Cross,N/A,34,USA,108 min,PG-13,Jean-Claude La Marre,tt0760160,274,English,"Jean-Claude La Marre, Johann John Jean, Adam Green, Jesse Holland",http://ia.media-imdb.com/images/M/MV5BMjAyMTgxOTAwNl5BMl5BanBnXkFtZTcwMzE2NTA0MQ@@._V1_SX300.jpg,movie,"Jean Claude Nelson, James Troesh, Jean-Claude La Marre",Drama,True,09 Nov 2006,3.3,"84,744"
5707157a71a065165c8c3af3,10 Items or Less,1 win & 1 nomination.,54,USA,82 min,R,Brad Silberling,tt0499603,"12,606","English, Spanish","Morgan Freeman, Paz Vega, Jonah Hill, Anne Dudek",http://ia.media-imdb.com/images/M/MV5BMTI1MTU4NjYzMV5BMl5BanBnXkFtZTcwNTg1NzQ0MQ@@._V1_SX300.jpg,movie,Brad Silberling,"Comedy, Drama",True,08 Feb 2007,6.7,"81,416"
5707157a71a065165c8c3af4,Samoan Wedding,10 nominations.,58,New Zealand,97 min,N/A,Chris Graham,tt0464184,"1,344",English,"Oscar Kightley, Iaheto Ah Hi, Shimpal Lelisi, Robbie Magasiva",http://ia.media-imdb.com/images/M/MV5BMjA0MTk2MDQ1N15BMl5BanBnXkFtZTcwMDE0MDczMQ@@._V1_SX300.jpg,movie,"James Griffin, Oscar Kightley","Comedy, Romance",True,30 Mar 2006,6.4,"71,840"
5707157a71a065165c8c3af5,Renaissance,2 wins & 1 nomination.,57,"France, UK, Luxembourg",105 min,R,Christian Volckman,tt0386741,"14,173","English, French","Daniel Craig, Romola Garai, Ian Holm, Kevork Malikyan",http://ia.media-imdb.com/images/M/MV5BMjEyMzA4ODQ3MV5BMl5BanBnXkFtZTcwMTkwNDUzMQ@@._V1_SX300.jpg,movie,"Alexandre de La Patellière (original story, Matthieu Delaporte (original story, Michael Katims (english dialogue, Alexandre de La Patellière (adaptation, Jean-Bernard Pouy (adaptation, Patrick Raynal (adaptation, Matthieu Delaporte (adaptation)","Animation, Action, Sci-Fi",True,15 Mar 2006,6.7,"63,260"
5707157a71a065165c8c3af6,Beowulf,N/A,N/A,USA,28 min,N/A,Tom Kingdon,tt1494639,N/A,English,"Nachum Cohen, Jola Cynkutis, Diane Edgecomb, Sarah Hickler",N/A,movie,N/A,"Short, Action, Drama",True,N/A,N/A,
5707157a71a065165c8c3af7,Unconscious,N/A,N/A,USA,N/A,N/A,Bradley Wigor,tt0455822,49,English,"Adam LeFevre, John Speredakos, Peter Friedman, Benjamin Walker",http://ia.media-imdb.com/images/M/MV5BMTU3MDYwMzM2Nl5BMl5BanBnXkFtZTcwNzg1ODIzMQ@@._V1_SX300.jpg,movie,George Williams,"Comedy, Drama",True,05 May 2009,6.5,
5707157a71a065165c8c3af8,Absolute Wilson,1 nomination.,69,"USA, Germany",105 min,UNRATED,Katharina Otto-Bernstein,tt0841992,119,English,"Robert Wilson, Arnold Aronson, Robin Brentano, David Byrne",http://ia.media-imdb.com/images/M/MV5BMTMyMTI0MzU1MF5BMl5BanBnXkFtZTcwODg4NTMwMw@@._V1_SX300.jpg,movie,Katharina Otto-Bernstein,Documentary,True,12 Oct 2006,7.0,"65,768"
5707157a71a065165c8c3af9,Vajra Sky Over Tibet,N/A,61,USA,89 min,N/A,John Bush,tt0840019,59,English,"John Bush, Tenzin Chogyal, Dadon",http://ia.media-imdb.com/images/M/MV5BMTg1MzI2Njg4OV5BMl5BanBnXkFtZTcwNjg4NTA0MQ@@._V1_SX300.jpg,movie,John Bush,Documentary,True,01 Sep 2006,7.2,"45,136"
5707157a71a065165c8c3afa,The Aura of Routine,N/A,N/A,USA,3 min,N/A,Shannon Moran,tt1424559,N/A,English,Alison Daley,N/A,movie,Shannon Moran,Short,True,07 Dec 2006,N/A,
5707157a71a065165c8c3afb,A Tudor Feast at Christmas,N/A,N/A,UK,59 min,N/A,Chris Mitchell,tt1232802,56,English,"Dominic Frisby, Marc Meltonville, Ruth Goodman, Hugh Beamish",N/A,movie,N/A,"Documentary, History",True,21 Dec 2006,8.5,
5707157a71a065165c8c3afc,Anthony Kaun Hai?,N/A,N/A,India,127 min,N/A,Raj Kaushal,tt0800981,482,Hindi,"Sanjay Dutt, Arshad Warsi, Minissha Lamba, Anusha Dhandekar",http://ia.media-imdb.com/images/M/MV5BODMzYTlhMTEtODQ4MC00YmRlLWIzYWQtMDk0MzI2OTZlNDUxXkEyXkFqcGdeQXVyNDUzOTQ5MjY@._V1_SX300.jpg,movie,Soumik Sen,"Comedy, Thriller",True,04 Aug 2006,5.5,
5707157a71a065165c8c3afd,10th & Wolf,N/A,36,USA,107 min,R,Robert Moresco,tt0360323,"5,476","English, Italian","James Marsden, Giovanni Ribisi, Brad Renfro, Piper Perabo",http://ia.media-imdb.com/images/M/MV5BMjE1NDE0Nzk3MV5BMl5BanBnXkFtZTcwMjE3ODQzMQ@@._V1_SX300.jpg,movie,"Robert Moresco, Allan Steele","Crime, Drama, Thriller",True,12 Apr 2007,6.5,"53,481"
5707157a71a065165c8c3afe,Kalamazoo?,N/A,N/A,USA,107 min,PG-13,David O'Malley,tt0416887,111,English,"Josie Davis, Mayim Bialik, Joanna Clare Scott, Claire Bloom",http://ia.media-imdb.com/images/M/MV5BMTY4OTM4OTM1NV5BMl5BanBnXkFtZTcwNDc4NzkyMQ@@._V1_SX300.jpg,movie,"Joanna Clare Scott (screenplay, Joanna Clare Scott (story, Dana E. Kowalski (story, Isabel Holtreman Baldree (story)",Comedy,True,07 Apr 2006,5.4,"53,609"
5707157a71a065165c8c3aff,Mannat,N/A,N/A,India,165 min,N/A,Gurbir Singh Grewal,tt0887764,92,Panjabi,"Jimmy Shergill, Kulraj Randhawa, Kanwaljit Singh, Deep Dhillon",N/A,movie,"Surinder Bath (dialogues, Gurbir Singh Grewal, Amber Hoshiarpuri (lyrics, Kulwant (lyrics, Babu Singh Mann (lyrics)","Action, Crime, Drama",True,06 Oct 2006,7.7,
5707157a71a065165c8c3b00,Close to You,5 nominations.,N/A,Philippines,110 min,N/A,Cathy Garcia-Molina,tt0498480,112,"Filipino, Tagalog","John Lloyd Cruz, Bea Alonzo, Sam Milby, Melanie Marquez",N/A,movie,"Mel Mendoza-Del Rosario (story, John Paul Abellera (story, Mel Mendoza-Del Rosario (screenplay)",Romance,True,15 Feb 2006,6.5,
5707157a71a065165c8c3b01,Home of the Brave,Nominated for 1 Golden Globe. Another 3 nominations.,42,"USA, Morocco",106 min,R,Irwin Winkler,tt0763840,"9,213","English, Spanish, Arabic","Samuel L. Jackson, Jessica Biel, Brian Presley, 50 Cent",http://ia.media-imdb.com/images/M/MV5BMjE5NjkwNDU1NV5BMl5BanBnXkFtZTcwNTkyNjgzMQ@@._V1_SX300.jpg,movie,"Mark Friedman (screenplay, Mark Friedman (story, Irwin Winkler (story)","Action, Drama, War",True,01 Mar 2007,5.6,"40,830"
5707157a71a065165c8c3b02,Moonlight,N/A,N/A,Nigeria,N/A,N/A,Ikenna Ezeugwu,tt1547481,N/A,English,"Chika Anyanwu, Nonso Diobi, Louisa Nwobodo, Georgina Onuoha",N/A,movie,N/A,N/A,True,N/A,N/A,
5707157a71a065165c8c3b03,Mini's First Time,1 win.,45,USA,91 min,R,Nick Guthe,tt0425253,"7,073",English,"Alec Baldwin, Nikki Reed, Carrie-Anne Moss, Jeff Goldblum",http://ia.media-imdb.com/images/M/MV5BMTU2NjE2Mjc0Nl5BMl5BanBnXkFtZTcwMTIxNjQzMQ@@._V1_SX300.jpg,movie,Nick Guthe,"Comedy, Crime, Drama",True,09 Aug 2007,5.9,"48,913"
5707157a71a065165c8c3b04,Two Weeks,1 nomination.,44,USA,102 min,R,Steve Stockman,tt0448166,"1,533",English,"Sally Field, Ben Chaplin, Lauren Aboulafia, Julianne Nicholson",http://ia.media-imdb.com/images/M/MV5BMTczNDEzNDU5MF5BMl5BanBnXkFtZTcwODM2Mjg4NA@@._V1_SX300.jpg,movie,Steve Stockman,"Comedy, Drama",True,20 Oct 2006,6.6,"45,816"
5707157a71a065165c8c3b05,Candy,6 wins & 17 nominations.,57,Australia,108 min,R,Neil Armfield,tt0424880,"35,127",English,"Abbie Cornish, Heath Ledger, Geoffrey Rush, Tom Budge",http://ia.media-imdb.com/images/M/MV5BMTY2NDQ1MTE3Nl5BMl5BanBnXkFtZTcwNTA3MzYzMQ@@._V1_SX300.jpg,movie,"Luke Davies (novel, Neil Armfield (screenplay, Luke Davies (screenplay)","Drama, Romance",True,25 May 2006,7.3,"44,720"
5707157a71a065165c8c3b06,Bâcharu fakku: Harusaki Azumi to shiyôyo,N/A,N/A,Japan,N/A,N/A,N/A,tt1250712,N/A,Japanese,Azumi Harusaki,N/A,movie,N/A,Adult,True,28 Jul 2006,N/A,
5707157a71a065165c8c3b07,Rape of the Soul,N/A,N/A,"Canada, USA",140 min,R,Michael A. Calace,tt0808438,138,English,"Michael A. Calace, Stanley Monteith, Robert Swan, Wilson Bryan Key",http://ia.media-imdb.com/images/M/MV5BMTkwNzcxNDU5NF5BMl5BanBnXkFtZTcwNzEyMjU1MQ@@._V1_SX300.jpg,movie,N/A,"Documentary, History",True,10 Mar 2006,6.5,
5707157a71a065165c8c3b08,The Philosopher Stoned,N/A,N/A,Canada,30 min,UNRATED,Susan Glover,tt0819920,16,English,Arthur Holden,N/A,movie,"Susan Glover, Arthur Holden","Documentary, Short",True,12 May 2006,6.9,
5707157a71a065165c8c3b09,Family Law,7 wins & 5 nominations.,66,"Argentina, Italy, Spain, France",102 min,UNRATED,Daniel Burman,tt0474622,"1,311","Spanish, Hebrew","Daniel Hendler, Arturo Goetz, Eloy Burman, Julieta Díaz",http://ia.media-imdb.com/images/M/MV5BMTI1NzI5ODAzOF5BMl5BanBnXkFtZTcwNTMzNTQ0MQ@@._V1_SX300.jpg,movie,Daniel Burman (screenwriter),"Comedy, Drama",True,23 Mar 2006,6.9,"37,810"
5707157a71a065165c8c3b0a,Eating Out 2: Sloppy Seconds,N/A,39,USA,79 min,NOT RATED,Phillip J. Bartell,tt0795376,"2,985",English,"Jim Verraros, Emily Brooke Hands, Rebekah Kochan, Brett Chukerman",http://ia.media-imdb.com/images/M/MV5BMTczNjIzOTU4Nl5BMl5BanBnXkFtZTcwNzc0MzI4Mg@@._V1_SX300.jpg,movie,"Phillip J. Bartell, Q. Allan Brocka","Comedy, Romance",True,05 Jul 2007,6.4,
5707157a71a065165c8c3b0b,Monkey Warfare,7 wins & 2 nominations.,N/A,Canada,75 min,N/A,Reginald Harkema,tt0832906,473,English,"Don McKellar, Tracy Wright, Nadia Litz, Marya Delver",http://ia.media-imdb.com/images/M/MV5BMjA5NzU0Mzk4OF5BMl5BanBnXkFtZTcwNzc0ODU2MQ@@._V1_SX300.jpg,movie,Reginald Harkema,"Comedy, Drama",True,10 Sep 2006,6.6,
5707157a71a065165c8c3b0c,Been Rich All My Life,1 win.,67,USA,81 min,N/A,Heather MacDonald,tt0810768,88,English,"Marion Coles, Elaine Ellis, Cleo Hayes, Fay Ray",http://ia.media-imdb.com/images/M/MV5BMTI2NTU5NTgzN15BMl5BanBnXkFtZTcwMjk1NzkzMQ@@._V1_SX300.jpg,movie,N/A,Documentary,True,04 Jan 2006,8.3,"33,745"
5707157a71a065165c8c3b0d,Can Mr. Smith Get to Washington Anymore?,1 win.,N/A,USA,82 min,NOT RATED,Frank Popper,tt1014673,202,English,"Nick Adams, Joan Barry, Charles Brennan, Russ Carnahan",http://ia.media-imdb.com/images/M/MV5BMzM5NjgxNjg3NF5BMl5BanBnXkFtZTcwNDgwMjU1MQ@@._V1_SX300.jpg,movie,"Matt Coen, Mike Kime, Frank Popper",Documentary,True,24 Nov 2006,7.4,
5707157a71a065165c8c3b0e,City Swimmers,N/A,N/A,N/A,54 min,N/A,Margaret Dickinson,tt1540821,N/A,N/A,N/A,N/A,movie,N/A,Documentary,True,N/A,N/A,
5707157a71a065165c8c3b0f,"My Country, My Country",Nominated for 1 Oscar. Another 2 nominations.,N/A,USA,90 min,N/A,Laura Poitras,tt4425258,118,English,N/A,http://ia.media-imdb.com/images/M/MV5BMjRiNmZiMDMtZDcyMS00NjQ0LWE2NjctNzY3MDA4YmJlMzAxXkEyXkFqcGdeQXVyMzE5MDE0OTQ@._V1_SX300.jpg,movie,Laura Poitras,Documentary,True,04 Aug 2006,7.2,
5707157a71a065165c8c3b10,Making 'Loverboy',N/A,N/A,USA,16 min,N/A,Phil Leirness,tt1379187,N/A,English,"Kevin Bacon, Daniel Bigel, Dominic Scott Kay, Kyra Sedgwick",N/A,movie,N/A,Short,True,19 Sep 2006,N/A,
5707157a71a065165c8c3b11,Nathalie perd le nord,N/A,N/A,France,N/A,N/A,Frédéric Compain,tt0801518,N/A,French,N/A,N/A,movie,N/A,Documentary,True,N/A,N/A,
5707157a71a065165c8c3b12,Broken Sky,1 win.,35,Mexico,140 min,PG-13,Julián Hernández,tt0783695,997,Spanish,"Miguel Ángel Hoppe, Fernando Arroyo, Alejandro Rojo, Ignacio Pereda",http://ia.media-imdb.com/images/M/MV5BMjEyMTgwMzgwNF5BMl5BanBnXkFtZTcwNTYyNTY1Mw@@._V1_SX300.jpg,movie,Julián Hernández,"Drama, Romance",True,29 Sep 2006,5.8,"28,683"
5707157a71a065165c8c3b13,Things You Don't Tell...,N/A,N/A,USA,100 min,R,Alex Melli,tt0487894,39,English,"Ryan Reyes, Noel Thurman, Amanda Bauman, Edward F. Villaume",http://ia.media-imdb.com/images/M/MV5BMTQ3MTM1NjgzOF5BMl5BanBnXkFtZTcwMzkwMDkzMQ@@._V1_SX300.jpg,movie,"Bibi Ong-VanZandt, Gloria Uhler",Thriller,True,N/A,5.4,
5707157a71a065165c8c3b14,Who Gets to Call It Art?,N/A,70,USA,78 min,N/A,Peter Rosen,tt0472210,123,English,"John Chamberlain, Ivan Karp, George Lois, Frank Stella",http://ia.media-imdb.com/images/M/MV5BODk1NzY4MzIwMF5BMl5BanBnXkFtZTcwMDM4OTkwMw@@._V1_SX300.jpg,movie,N/A,Documentary,True,01 Feb 2006,6.8,"27,344"
5707157a71a065165c8c3b15,Abduction: The Megumi Yokota Story,4 wins.,72,"UK, USA",85 min,N/A,"Patty Kim, Chris Sheridan",tt0495060,170,Japanese,"Teruaki Masumoto, Megumi Yokota, Sakie Yokota, Shigeru Yokota",http://ia.media-imdb.com/images/M/MV5BMjE5MzI3MTAyMF5BMl5BanBnXkFtZTcwMTc2MDUzMQ@@._V1_SX300.jpg,movie,Patty Kim,"Documentary, Crime, Mystery",True,25 Nov 2006,7.9,
5707157a71a065165c8c3b16,Wrestling with Angels: Playwright Tony Kushner,N/A,64,USA,98 min,N/A,Freida Lee Mock,tt0493081,70,English,"Firdous Bamji, Bill Camp, Harrison Chad, Jay Charan",http://ia.media-imdb.com/images/M/MV5BMjE4NjA1ODE0Nl5BMl5BanBnXkFtZTcwOTI5NzgzMQ@@._V1_SX300.jpg,movie,Freida Lee Mock,Documentary,True,01 Jan 2006,7.8,"24,729"
5707157a71a065165c8c3b17,Off the Black,N/A,62,USA,90 min,R,James Ponsoldt,tt0479965,"1,141",English,"Trevor Morgan, Nick Nolte, Rosemarie DeWitt, Thomas Schall",http://ia.media-imdb.com/images/M/MV5BMjEyNDYwODk5NF5BMl5BanBnXkFtZTYwMjE3MjA3._V1_SX300.jpg,movie,James Ponsoldt,Drama,True,08 Dec 2006,6.7,"24,035"
5707157a71a065165c8c3b18,The Strange Case of Dr. Jekyll and Mr. Hyde,N/A,N/A,USA,89 min,R,John Carl Buechler,tt0472186,259,English,"Tony Todd, Tracy Scoggins, Vernon Wells, Stephen Wastell",http://ia.media-imdb.com/images/M/MV5BMjU3MzEzNjU2MV5BMl5BanBnXkFtZTcwMzI4NjkzMQ@@._V1_SX300.jpg,movie,"John Carl Buechler (screenplay, Robert Louis Stevenson (novel)",Horror,True,29 Sep 2006,3.8,"19,111"
5707157a71a065165c8c3b19,Islam: What the West Needs to Know,N/A,N/A,USA,98 min,NOT RATED,"Bryan Daly, Gregory M. Davis",tt0818682,522,English,"Abdullah Al-Araby, Walid Shoebat, Robert Spencer, Serge Trifkovic",http://ia.media-imdb.com/images/M/MV5BMTk5MDMyNzAwN15BMl5BanBnXkFtZTcwODkzMzQzMQ@@._V1_SX300.jpg,movie,N/A,Documentary,True,15 Jan 2006,6.7,"12,184"
5707157a71a065165c8c3b1a,Ambrose Bierce: Civil War Stories,N/A,N/A,USA,93 min,N/A,"Don Maxwell, Brian James Egen",tt0476053,103,English,"Campbell Scott, Vivian Schilling, Nathan Darrow, T. Max Graham",http://ia.media-imdb.com/images/M/MV5BMTMxODk5ODM2N15BMl5BanBnXkFtZTcwNTE3MjEzMQ@@._V1_SX300.jpg,movie,"Ambrose Bierce (short stories, Brian James Egen (screenplay, Kathrin Gnorski, Don Maxwell","Biography, Drama, History",True,15 Sep 2006,6.2,"6,820"
5707157a71a065165c8c3b1b,Holy F#@k! It's Huge!,N/A,N/A,N/A,N/A,N/A,Juan Cuba,tt1027068,N/A,N/A,"Jayden Jaymes, Isabella, Veronica Stone, Aline",N/A,movie,N/A,Adult,True,N/A,N/A,
5707157a71a065165c8c3b1c,So Much So Fast,1 win & 2 nominations.,79,USA,87 min,N/A,"Steven Ascher, Jeanne Jordan",tt0492488,195,English,"Jesse Abbott-Dallamora, Robert Bonazoli, Tyler DiVittorio, Benjamin Heywood",http://ia.media-imdb.com/images/M/MV5BMjA0MDE1MTI1MF5BMl5BanBnXkFtZTcwOTc1MDkzMQ@@._V1_SX300.jpg,movie,"Steven Ascher, Jeanne Jordan",Documentary,True,11 Oct 2006,7.6,"11,167"
5707157a71a065165c8c3b1d,London,N/A,N/A,"UK, USA",120 min,X,Collin O'Neal,tt0939895,7,English,"Edu Boxer, Fred Colcci, Forneus, Jean Francko",N/A,movie,N/A,Adult,True,N/A,7.0,
5707157a71a065165c8c3b1e,The Ground Truth,1 win & 1 nomination.,74,USA,72 min,R,Patricia Foulkrod,tt0446345,687,English,"Robert Acosta, Kelly Dougherty, Patricia Foulkrod, Nicole Huze",http://ia.media-imdb.com/images/M/MV5BMTI3MzcyNDY0OF5BMl5BanBnXkFtZTcwMTU4MjYzMQ@@._V1_SX300.jpg,movie,Patricia Foulkrod,"Documentary, War",True,19 Jan 2006,7.6,"12,207"
5707157a71a065165c8c3b1f,The Dead Girl,2 wins & 4 nominations.,65,USA,85 min,R,Karen Moncrieff,tt0783238,"12,079",English,"Toni Collette, Piper Laurie, Donnie Smith, Michael Raysses",http://ia.media-imdb.com/images/M/MV5BNzE4MDYzMzg3MF5BMl5BanBnXkFtZTcwNDU2ODA0MQ@@._V1_SX300.jpg,movie,Karen Moncrieff,"Crime, Drama, Mystery",True,26 Apr 2007,6.7,"17,311"
5707157a71a065165c8c3b20,El perro catalán,N/A,N/A,Spain,N/A,N/A,Wilson Solon,tt2648056,N/A,Spanish,"Pep Mogas, Jaume Najarro",N/A,movie,Josep Mogas,"Short, Comedy",True,08 Nov 2006,N/A,
5707157a71a065165c8c3b21,Suicide Killers,N/A,N/A,USA,80 min,N/A,Pierre Rehov,tt0830968,196,"Italian, Arabic, French, Hebrew, Spanish, English","Chadhoorth Djawann, Jacinto Dumbal, Judge Dumbroso, Boaz Ganor",http://ia.media-imdb.com/images/M/MV5BMTkzNjYwOTg3Ml5BMl5BanBnXkFtZTcwNDIzMDQ0MQ@@._V1_SX300.jpg,movie,N/A,Documentary,True,25 Aug 2006,6.6,"10,601"
5707157a71a065165c8c3b22,Ever Again,N/A,N/A,USA,73 min,N/A,Richard Trank,tt0930057,42,English,"Kevin Costner, Milo Adoner, Yusuf Al-Qaradawi, Hani Al-Sibai",http://ia.media-imdb.com/images/M/MV5BMTMyMDYyMjY2MV5BMl5BanBnXkFtZTcwODE4ODM4Mg@@._V1_SX300.jpg,movie,"Marvin Hier, Richard Trank (screenplay)","Documentary, History, War",True,08 Dec 2006,6.5,
5707157a71a065165c8c3b23,Matthew Barney: No Restraint,1 nomination.,59,USA,72 min,N/A,Alison Chernick,tt0481574,99,"Japanese, English","Matthew Barney, Björk",http://ia.media-imdb.com/images/M/MV5BMTk1OTY5OTc3Nl5BMl5BanBnXkFtZTcwMDc2Mjc0MQ@@._V1_SX300.jpg,movie,Alison Chernick,Documentary,True,04 Oct 2008,6.3,"16,136"
5707157a71a065165c8c3b24,Sleeping Dogs Lie,3 nominations.,63,USA,87 min,R,Bobcat Goldthwait,tt0492492,"2,726",English,"Melinda Page Hamilton, Bryce Johnson, Geoff Pierson, Colby French",http://ia.media-imdb.com/images/M/MV5BMTQwODU4MTQ4OV5BMl5BanBnXkFtZTcwOTAwNjI0MQ@@._V1_SX300.jpg,movie,Bobcat Goldthwait,"Comedy, Drama, Romance",True,21 Feb 2007,5.9,"10,890"
5707157a71a065165c8c3b25,See No Evil,N/A,17,"USA, Australia",84 min,R,Gregory Dark,tt0437179,"21,405",English,"Glenn Jacobs, Christina Vidal, Michael J. Pagan, Samantha Noble",http://ia.media-imdb.com/images/M/MV5BMTg3MTgxNDI1MV5BMl5BanBnXkFtZTcwMTkzMjYzMQ@@._V1_SX300.jpg,movie,Dan Madigan,"Action, Horror, Thriller",True,19 May 2006,5.1,"15,019,200"
5707157a71a065165c8c3b26,My First Wedding,N/A,N/A,"Canada, UK",94 min,PG-13,Laurent Firode,tt0388288,929,English,"Rachael Leigh Cook, Kenny Doughty, Paul Hopkins, Valerie Mahaffey",http://ia.media-imdb.com/images/M/MV5BMTgyOTcxNjQ2N15BMl5BanBnXkFtZTcwNDgxNTkzMQ@@._V1_SX300.jpg,movie,Joan Carr-Wiggin,"Comedy, Romance",True,15 Mar 2007,4.8,
5707157a71a065165c8c3b27,Hannari: Geisha Modern,N/A,N/A,Japan,94 min,N/A,Miyuki Sohara,tt1114678,N/A,Japanese,"Maxwell Caulfield, Kentarô Kajino",N/A,movie,"Kentarô Kajino, Miyuki Sohara",Documentary,True,01 Nov 2006,N/A,
5707157a71a065165c8c3b28,Opal Dream,1 win & 2 nominations.,56,"Australia, UK",86 min,PG,Peter Cattaneo,tt0420835,802,English,"Sapphire Boyce, Christian Byers, Vince Colosimo, Jacqueline McKenzie",http://ia.media-imdb.com/images/M/MV5BMTY4OTA1NDk4Ml5BMl5BanBnXkFtZTcwNTQ3NjI0MQ@@._V1_SX300.jpg,movie,"Peter Cattaneo (screenplay, Phil Traill (screenplay, Ben Rice (screenplay, Ben Rice (novel)","Drama, Family",True,22 Nov 2006,6.7,"13,751"
5707157a71a065165c8c3b29,The Architect,N/A,47,USA,82 min,R,Matt Tauber,tt0466665,935,English,"Anthony LaPaglia, Viola Davis, Isabella Rossellini, Hayden Panettiere",http://ia.media-imdb.com/images/M/MV5BMTUzMzAzNjU5OV5BMl5BanBnXkFtZTcwMTg3MDA0MQ@@._V1_SX300.jpg,movie,"David Greig, Matt Tauber",Drama,True,01 Apr 2006,5.6,"12,644"
5707157a71a065165c8c3b2a,Who the #$&% Is Jackson Pollock?,N/A,70,USA,74 min,PG-13,Harry Moses,tt0487092,"1,016",English,"Teri Horton, Tod M. Volpe, Ben Heller, Nick Carone",http://ia.media-imdb.com/images/M/MV5BMTcyMTQ1Mzk1OV5BMl5BanBnXkFtZTcwMDM3OTY0MQ@@._V1_SX300.jpg,movie,Harry Moses,Documentary,True,09 Nov 2006,7.1,
5707157a71a065165c8c3b2b,I Trust You to Kill Me,N/A,53,USA,105 min,R,Manu Boyer,tt0800081,289,English,"David Beste, Ryan Carman, Greg Velasquez, Jon Cassar",http://ia.media-imdb.com/images/M/MV5BMTI0NjA0MjQwMF5BMl5BanBnXkFtZTcwOTIxOTI0MQ@@._V1_SX300.jpg,movie,N/A,"Documentary, Music",True,22 Apr 2006,7.5,"12,737"
