_id,Released,Writer,Type,imdbVotes,Response,Genre,Metascore,imdbID,imdbRating,Title,Rated,Language,Country,Box_office,Runtime,Actors,Director,Awards,Poster
5707203271a0650af414def2,04 May 2007,"Sam Raimi (screenplay, Ivan Raimi (screenplay, Alvin Sargent (screenplay, Sam Raimi (screen story, Ivan Raimi (screen story, Stan Lee (Marvel comic book, Steve Ditko (Marvel comic book)",movie,"367,005",True,"Action, Adventure",59,tt0413300,6.2,Spider-Man 3,PG-13,"English, French",USA,"336,530,303",139 min,"Tobey Maguire, Kirsten Dunst, James Franco, Thomas Haden Church",Sam Raimi,Nominated for 1 BAFTA Film Award. Another 3 wins & 31 nominations.,http://ia.media-imdb.com/images/M/MV5BODUwMDc5Mzc5M15BMl5BanBnXkFtZTcwNDgzOTY0MQ@@._V1_SX300.jpg
5707203271a0650af414def3,18 May 2007,"William Steig (book, Andrew Adamson (story, Jeffrey Price (screenplay, Peter S. Seaman (screenplay, Chris Miller (screenplay, Aron Warner (screenplay, Jeff Snow (story)",movie,"204,864",True,"Animation, Adventure, Comedy",58,tt0413267,6.1,Shrek the Third,PG,English,USA,,93 min,"Mike Myers, Eddie Murphy, Cameron Diaz, Antonio Banderas","Chris Miller, Raman Hui",Nominated for 1 BAFTA Film Award. Another 5 wins & 14 nominations.,http://ia.media-imdb.com/images/M/MV5BMTMyMjE1Mjc1NF5BMl5BanBnXkFtZTcwMzY0MjEzMw@@._V1_SX300.jpg
5707203271a0650af414def4,03 Jul 2007,"Roberto Orci (screenplay, Alex Kurtzman (screenplay, John Rogers (story, Roberto Orci (story, Alex Kurtzman (story)",movie,"499,180",True,"Action, Adventure, Sci-Fi",61,tt0418279,7.1,Transformers,PG-13,"English, Spanish",USA,"318,759,914",144 min,"Shia LaBeouf, Megan Fox, Josh Duhamel, Tyrese Gibson",Michael Bay,Nominated for 3 Oscars. Another 19 wins & 40 nominations.,http://ia.media-imdb.com/images/M/MV5BMTQwNjU5MzUzNl5BMl5BanBnXkFtZTYwMzc1MTI3._V1_SX300.jpg
5707203271a0650af414def5,25 May 2007,"Ted Elliott, Terry Rossio, Ted Elliott (characters, Terry Rossio (characters, Stuart Beattie (characters, Jay Wolpert (characters)",movie,"454,759",True,"Action, Adventure, Fantasy",50,tt0449088,7.1,Pirates of the Caribbean: At World's End,PG-13,English,USA,"309,404,152",169 min,"Johnny Depp, Geoffrey Rush, Orlando Bloom, Keira Knightley",Gore Verbinski,Nominated for 2 Oscars. Another 20 wins & 41 nominations.,http://ia.media-imdb.com/images/M/MV5BMjIyNjkxNzEyMl5BMl5BanBnXkFtZTYwMjc3MDE3._V1_SX300.jpg
5707203271a0650af414def6,11 Jul 2007,"Michael Goldenberg (screenplay, J.K. Rowling (novel)",movie,"341,230",True,"Adventure, Family, Fantasy",71,tt0373889,7.5,Harry Potter and the Order of the Phoenix,PG-13,English,"UK, USA","292,000,866",138 min,"Daniel Radcliffe, Harry Melling, Jason Boyd, Richard Macklin",David Yates,Nominated for 2 BAFTA Film Awards. Another 15 wins & 38 nominations.,http://ia.media-imdb.com/images/M/MV5BMTM0NTczMTUzOV5BMl5BanBnXkFtZTYwMzIxNTg3._V1_SX300.jpg
5707203271a0650af414def7,14 Dec 2007,"Mark Protosevich (screenplay, Akiva Goldsman (screenplay, Richard Matheson (novel, John William Corrington, Joyce Hooper Corrington",movie,"509,577",True,"Drama, Sci-Fi, Thriller",65,tt0480249,7.2,I Am Legend,PG-13,English,USA,"256,386,216",101 min,"Will Smith, Alice Braga, Charlie Tahan, Salli Richardson-Whitfield",Francis Lawrence,9 wins & 21 nominations.,http://ia.media-imdb.com/images/M/MV5BMTU4NzMyNDk1OV5BMl5BanBnXkFtZTcwOTEwMzU1MQ@@._V1_SX300.jpg
5707203271a0650af414def8,03 Aug 2007,"Tony Gilroy (screenplay, Scott Z. Burns (screenplay, George Nolfi (screenplay, Tony Gilroy (screen story, Robert Ludlum (novel)",movie,"471,344",True,"Action, Thriller",85,tt0440963,8.1,The Bourne Ultimatum,PG-13,"English, French, Arabic, Russian, Spanish","USA, Germany","227,137,090",115 min,"Matt Damon, Julia Stiles, David Strathairn, Scott Glenn",Paul Greengrass,Won 3 Oscars. Another 25 wins & 38 nominations.,http://ia.media-imdb.com/images/M/MV5BMTgzNjMwOTM3N15BMl5BanBnXkFtZTcwMzA5MDY0MQ@@._V1_SX300.jpg
5707203271a0650af414def9,21 Dec 2007,"Marianne Wibberley (screenplay, Cormac Wibberley (screenplay, Gregory Poirier (story, Marianne Wibberley (story, Cormac Wibberley (story, Ted Elliott (story, Terry Rossio (story, Jim Kouf (characters, Oren Aviv (characters, Charles Segars (characters)",movie,"178,143",True,"Action, Adventure, Mystery",48,tt0465234,6.5,National Treasure: Book of Secrets,PG,"English, French",USA,"219,961,501",124 min,"Nicolas Cage, Justin Bartha, Diane Kruger, Jon Voight",Jon Turteltaub,5 nominations.,http://ia.media-imdb.com/images/M/MV5BMTU2NTM3NjU1N15BMl5BanBnXkFtZTcwODg1MDU1MQ@@._V1_SX300.jpg
5707203271a0650af414defa,14 Dec 2007,"Jon Vitti (screenplay, Will McRobb (screenplay, Chris Viscardi (screenplay, Jon Vitti (story, Ross Bagdasarian (characters Alvin and the Chipmunks)",movie,"54,982",True,"Animation, Comedy, Family",39,tt0952640,5.3,Alvin and the Chipmunks,PG,"English, French, Spanish, Japanese",USA,"217,326,336",92 min,"Jason Lee, David Cross, Cameron Richardson, Jane Lynch",Tim Hill,2 wins & 2 nominations.,http://ia.media-imdb.com/images/M/MV5BMTIwOTE4MTU4MV5BMl5BanBnXkFtZTcwMDk1MDU1MQ@@._V1_SX300.jpg
5707203271a0650af414defb,N/A,"Alexander Emmert, Matt Koed, David Padrusch",movie,716,True,Documentary,N/A,tt0892737,7.8,Last Stand of the 300,N/A,English,USA,,91 min,"Jeffery A. Baker, Orion Barnes, Erin Bennett, Kristopher Blount",David Padrusch,N/A,http://ia.media-imdb.com/images/M/MV5BMTI4MjExNTU3NF5BMl5BanBnXkFtZTcwMjIzNzQ0MQ@@._V1_SX300.jpg
5707203271a0650af414defc,29 Jun 2007,"Brad Bird (screenwriter, Jan Pinkava (original story by, Jim Capobianco (original story by, Brad Bird (original story by)",movie,"452,942",True,"Animation, Comedy, Family",96,tt0382932,8.0,Ratatouille,G,"English, French",USA,,111 min,"Patton Oswalt, Ian Holm, Lou Romano, Brian Dennehy","Brad Bird, Jan Pinkava",Won 1 Oscar. Another 64 wins & 42 nominations.,http://ia.media-imdb.com/images/M/MV5BMTMzODU0NTkxMF5BMl5BanBnXkFtZTcwMjQ4MzMzMw@@._V1_SX300.jpg
5707203271a0650af414defd,27 Jul 2007,"James L. Brooks (screenplay, Matt Groening (screenplay, Al Jean (screenplay, Ian Maxtone-Graham (screenplay, George Meyer (screenplay, David Mirkin (screenplay, Mike Reiss (screenplay, Mike Scully (screenplay, Matt Selman (screenplay, John Swartzwelder (screenplay, Jon Vitti (screenplay, Joel H. Cohen (consultant writer, John Frink (consultant writer, Tim Long (consultant writer, Michael Price (consultant writer)",movie,"251,669",True,"Animation, Adventure, Comedy",80,tt0462538,7.4,The Simpsons Movie,PG-13,English,USA,"183,132,370",87 min,"Dan Castellaneta, Julie Kavner, Nancy Cartwright, Yeardley Smith",David Silverman,Nominated for 1 Golden Globe. Another 4 wins & 32 nominations.,http://ia.media-imdb.com/images/M/MV5BMTgxMDczMTA5N15BMl5BanBnXkFtZTcwMzk1MzMzMw@@._V1_SX300.jpg
5707203271a0650af414defe,02 Mar 2007,Brad Copeland,movie,"98,183",True,"Action, Adventure, Comedy",27,tt0486946,5.9,Wild Hogs,PG-13,English,USA,"168,213,584",100 min,"Tim Allen, John Travolta, Martin Lawrence, William H. Macy",Walt Becker,4 nominations.,http://ia.media-imdb.com/images/M/MV5BMTQ4MTE5MjY5OV5BMl5BanBnXkFtZTcwNDEwMzUzMw@@._V1_SX300.jpg
5707203271a0650af414deff,01 Jun 2007,Judd Apatow,movie,"291,978",True,"Comedy, Romance",85,tt0478311,7.0,Knocked Up,R,English,USA,,129 min,"Seth Rogen, Katherine Heigl, Paul Rudd, Leslie Mann",Judd Apatow,7 wins & 25 nominations.,http://ia.media-imdb.com/images/M/MV5BMTU1Njk0ODEwOF5BMl5BanBnXkFtZTYwMzA3ODc2._V1_SX300.jpg
5707203271a0650af414df00,25 Dec 2007,Diablo Cody,movie,"402,370",True,"Comedy, Drama, Romance",81,tt0467406,7.5,Juno,PG-13,English,USA,"143,492,840",96 min,"Ellen Page, Michael Cera, Jennifer Garner, Jason Bateman",Jason Reitman,Won 1 Oscar. Another 88 wins & 91 nominations.,http://ia.media-imdb.com/images/M/MV5BMTgxMjgyMTcyNF5BMl5BanBnXkFtZTcwMDg1MTU1MQ@@._V1_SX300.jpg
5707203271a0650af414df01,10 Aug 2007,"Jeff Nathanson, Ross LaManna (characters)",movie,"116,977",True,"Action, Comedy, Crime",44,tt0293564,6.2,Rush Hour 3,PG-13,"English, French, Japanese, Mandarin, Latin","USA, Germany","140,080,850",91 min,"Chris Tucker, Jackie Chan, Max von Sydow, Hiroyuki Sanada",Brett Ratner,9 nominations.,http://ia.media-imdb.com/images/M/MV5BMTA0Nzg5NjQ0MDBeQTJeQWpwZ15BbWU3MDE4Mzg5NDE@._V1_SX300.jpg
5707203271a0650af414df02,27 Jun 2007,"Mark Bomback (screenplay, Mark Bomback (story, David Marconi (story, John Carlin (article, Roderick Thorp (certain original characters)",movie,"329,631",True,"Action, Adventure, Thriller",69,tt0337978,7.2,Live Free or Die Hard,PG-13,"English, Italian, French","USA, UK","134,520,804",128 min,"Bruce Willis, Timothy Olyphant, Justin Long, Maggie Q",Len Wiseman,3 wins & 16 nominations.,http://ia.media-imdb.com/images/M/MV5BNDQxMDE1OTg4NV5BMl5BanBnXkFtZTcwMTMzOTQzMw@@._V1_SX300.jpg
5707203271a0650af414df03,15 Jun 2007,"Don Payne (screenplay, Mark Frost (screenplay, John Turman (story, Mark Frost (story, Stan Lee (characters, Jack Kirby (characters)",movie,"206,265",True,"Action, Adventure, Sci-Fi",45,tt0486576,5.6,Fantastic Four: Rise of the Silver Surfer,PG,"English, Japanese, Chinese, Arabic","USA, Germany, UK","131,920,333",92 min,"Ioan Gruffudd, Jessica Alba, Chris Evans, Michael Chiklis",Tim Story,2 wins & 14 nominations.,http://ia.media-imdb.com/images/M/MV5BMTgxMDc2NzA4MV5BMl5BanBnXkFtZTcwOTI1NTY0MQ@@._V1_SX300.jpg
5707203271a0650af414df04,02 Nov 2007,"Steven Zaillian, Mark Jacobson (article)",movie,"318,380",True,"Biography, Crime, Drama",76,tt0765429,7.8,American Gangster,R,English,"USA, UK","130,127,620",157 min,"Denzel Washington, Russell Crowe, Chiwetel Ejiofor, Josh Brolin",Ridley Scott,Nominated for 2 Oscars. Another 12 wins & 34 nominations.,http://ia.media-imdb.com/images/M/MV5BMTkyNzY5MDA5MV5BMl5BanBnXkFtZTcwMjg4MzI3MQ@@._V1_SX300.jpg
5707203271a0650af414df05,21 Nov 2007,Bill Kelly,movie,"137,615",True,"Animation, Comedy, Family",75,tt0461770,7.1,Enchanted,PG,English,USA,"127,706,877",107 min,"Amy Adams, Patrick Dempsey, James Marsden, Timothy Spall",Kevin Lima,Nominated for 3 Oscars. Another 11 wins & 47 nominations.,http://ia.media-imdb.com/images/M/MV5BMjE4NDQ2Mjc0OF5BMl5BanBnXkFtZTcwNzQ2NDE1MQ@@._V1_SX300.jpg
5707203271a0650af414df06,02 Nov 2007,"Jerry Seinfeld, Spike Feresten, Barry Marder, Andy Robin, Chuck Martin (additional screenplay material, Tom Papa (additional screenplay material)",movie,"101,853",True,"Animation, Adventure, Comedy",54,tt0389790,6.2,Bee Movie,PG,English,"USA, Australia","126,597,121",91 min,"Jerry Seinfeld, Renée Zellweger, Matthew Broderick, Patrick Warburton","Steve Hickner, Simon J. Smith",Nominated for 1 Golden Globe. Another 1 win & 14 nominations.,http://ia.media-imdb.com/images/M/MV5BMjE1MDYxOTA4MF5BMl5BanBnXkFtZTcwMDE0MDUzMw@@._V1_SX300.jpg
5707203271a0650af414df07,17 Aug 2007,"Seth Rogen, Evan Goldberg",movie,"411,716",True,Comedy,76,tt0829482,7.6,Superbad,R,English,USA,,113 min,"Jonah Hill, Michael Cera, Christopher Mintz-Plasse, Bill Hader",Greg Mottola,11 wins & 24 nominations.,http://ia.media-imdb.com/images/M/MV5BMTc0NjIyMjA2OF5BMl5BanBnXkFtZTcwMzIxNDE1MQ@@._V1_SX300.jpg
5707203271a0650af414df08,30 Mar 2007,"Jeff Cox (screenplay, Craig Cox (screenplay, John Altschuler (screenplay, Dave Krinsky (screenplay, Craig Cox (story, Jeff Cox (story, Busy Philipps (story)",movie,"126,450",True,"Comedy, Sport",64,tt0445934,6.3,Blades of Glory,PG-13,"English, Japanese",USA,"118,153,533",93 min,"Will Ferrell, Jon Heder, Will Arnett, Amy Poehler","Josh Gordon, Will Speck",3 wins & 10 nominations.,http://ia.media-imdb.com/images/M/MV5BMTY3MDMyMTYxMl5BMl5BanBnXkFtZTcwMjk0NzI0MQ@@._V1_SX300.jpg
5707203271a0650af414df09,08 Jun 2007,"Brian Koppelman, David Levien, George Clayton Johnson (characters, Jack Golden Russell (characters)",movie,"249,213",True,"Crime, Thriller",62,tt0496806,6.9,Ocean's Thirteen,PG-13,"English, French, Spanish",USA,"117,144,465",122 min,"George Clooney, Brad Pitt, Matt Damon, Michael Mantell",Steven Soderbergh,1 win & 5 nominations.,http://ia.media-imdb.com/images/M/MV5BMTMyNTc1NzY5MV5BMl5BanBnXkFtZTcwNDM4NTQzMw@@._V1_SX300.jpg
5707203271a0650af414df0a,16 Feb 2007,"Mark Steven Johnson (screenplay, Mark Steven Johnson (screen story)",movie,"176,738",True,"Action, Fantasy, Thriller",35,tt0259324,5.2,Ghost Rider,PG-13,English,"USA, Australia","115,802,596",114 min,"Matt Long, Raquel Alessi, Brett Cullen, Peter Fonda",Mark Steven Johnson,8 nominations.,http://ia.media-imdb.com/images/M/MV5BMzIyNDE5ODI1OV5BMl5BanBnXkFtZTcwNTIyNDE0MQ@@._V1_SX300.jpg
5707203271a0650af414df0b,22 Jun 2007,"Steve Oedekerk (screenplay, Steve Oedekerk (story, Joel Cohen (story, Alec Sokolow (story, Steve Koren (characters, Mark O'Keefe (characters)",movie,"112,749",True,"Comedy, Family, Fantasy",37,tt0413099,5.4,Evan Almighty,PG,English,USA,"100,289,690",96 min,"Steve Carell, Morgan Freeman, Lauren Graham, Johnny Simmons",Tom Shadyac,2 wins & 11 nominations.,http://ia.media-imdb.com/images/M/MV5BMTUxMTEzODYxMV5BMl5BanBnXkFtZTcwNzQ4ODU0MQ@@._V1_SX300.jpg
5707203271a0650af414df0c,30 Mar 2007,"Jon Bernstein (screenplay, Michelle Bochner Spitz (screenplay, Don Hall (screenplay, Nathan Greno (screenplay, Aurian Redson (screenplay, Joseph Mateo (screenplay, Stephen J. Anderson (screenplay, William Joyce (based upon the book \",movie,"64,095",True,"Animation, Adventure, Comedy",61,tt0396555,6.9,Meet the Robinsons,G,English,USA,"97,821,064",95 min,"Angela Bassett, Daniel Hansen, Jordan Fry, Matthew Josten",Stephen J. Anderson,1 win & 10 nominations.,http://ia.media-imdb.com/images/M/MV5BMTg0NTU4MDY5OV5BMl5BanBnXkFtZTcwMzY0MjM0MQ@@._V1_SX300.jpg
5707203271a0650af414df0d,09 Feb 2007,"Eddie Murphy (screenplay, Charlie Murphy (screenplay, Jay Scherick (screenplay, David Ronn (screenplay, Eddie Murphy (story, Charlie Murphy (story)",movie,"51,538",True,"Comedy, Drama, Romance",27,tt0477051,3.9,Norbit,PG-13,English,USA,"95,323,496",102 min,"Eddie Murphy, Thandie Newton, Terry Crews, Clifton Powell",Brian Robbins,Nominated for 1 Oscar. Another 8 wins & 8 nominations.,http://ia.media-imdb.com/images/M/MV5BMTI4NDE4MjgyNV5BMl5BanBnXkFtZTcwMTQwODc0MQ@@._V1_SX300.jpg
5707203271a0650af414df0e,11 Jan 2008,Justin Zackham,movie,"180,481",True,"Adventure, Comedy, Drama",42,tt0825232,7.4,The Bucket List,PG-13,English,USA,"93,452,056",97 min,"Jack Nicholson, Morgan Freeman, Sean Hayes, Beverly Todd",Rob Reiner,2 wins & 4 nominations.,http://ia.media-imdb.com/images/M/MV5BMTY2NTUyMjIyNF5BMl5BanBnXkFtZTYwNzYwMDM4._V1_SX300.jpg
5707203271a0650af414df0f,28 Sep 2007,"Nichole Millard (screenplay, Kathryn Price (screenplay, Nichole Millard (story, Kathryn Price (story, Audrey Wells (story)",movie,"42,546",True,"Comedy, Family, Sport",44,tt0492956,6.2,The Game Plan,PG,English,USA,,110 min,"Dwayne Johnson, Madison Pettis, Kyra Sedgwick, Roselyn Sanchez",Andy Fickman,3 nominations.,http://ia.media-imdb.com/images/M/MV5BMTAzNDIyODYzMTJeQTJeQWpwZ15BbWU3MDA3NTA5NDE@._V1_SX300.jpg
5707203271a0650af414df10,16 Nov 2007,"Neil Gaiman (screenplay, Roger Avary (screenplay, Anonymous (epic poem \",movie,"140,202",True,"Animation, Action, Adventure",59,tt0442933,6.3,Beowulf,PG-13,"English, Old English",USA,"82,161,969",115 min,"Robin Wright, Anthony Hopkins, Paul Baker, John Bilezikjian",Robert Zemeckis,2 wins & 16 nominations.,http://ia.media-imdb.com/images/M/MV5BMTUzMjM0MTc3MF5BMl5BanBnXkFtZTcwNzU0ODMyMw@@._V1_SX300.jpg
5707203271a0650af414df11,16 Feb 2007,"Jeff Stockwell (screenplay, David Paterson (screenplay, Katherine Paterson (book)",movie,"106,806",True,"Adventure, Drama, Family",74,tt0398808,7.2,Bridge to Terabithia,PG,English,"USA, New Zealand","82,234,139",96 min,"Josh Hutcherson, AnnaSophia Robb, Zooey Deschanel, Robert Patrick",Gabor Csupo,6 wins & 5 nominations.,http://ia.media-imdb.com/images/M/MV5BMTMzOTk1MzIyN15BMl5BanBnXkFtZTcwNTM3MjczMQ@@._V1_SX300.jpg
5707203271a0650af414df12,13 Apr 2007,"Christopher Landon (screenplay, Carl Ellsworth (screenplay, Christopher Landon (story)",movie,"183,041",True,"Drama, Mystery, Thriller",62,tt0486822,6.9,Disturbia,PG-13,"English, Spanish",USA,,105 min,"Shia LaBeouf, Sarah Roemer, Carrie-Anne Moss, David Morse",D.J. Caruso,4 wins & 6 nominations.,http://ia.media-imdb.com/images/M/MV5BMTMyNTIxOTQ3M15BMl5BanBnXkFtZTcwMjU2NzAzMw@@._V1_SX300.jpg
5707203271a0650af414df13,21 Nov 2007,"Joel Coen (screenplay, Ethan Coen (screenplay, Cormac McCarthy (novel)",movie,"588,079",True,"Crime, Drama, Thriller",91,tt0477348,8.1,No Country for Old Men,R,"English, Spanish",USA,"74,273,505",122 min,"Tommy Lee Jones, Javier Bardem, Josh Brolin, Woody Harrelson","Ethan Coen, Joel Coen",Won 4 Oscars. Another 155 wins & 128 nominations.,http://ia.media-imdb.com/images/M/MV5BMjA5Njk3MjM4OV5BMl5BanBnXkFtZTcwMTc5MTE1MQ@@._V1_SX300.jpg
5707203271a0650af414df14,09 Nov 2007,"Dan Fogelman (screenplay, Jessie Nelson (story, Dan Fogelman (story)",movie,"31,059",True,"Comedy, Family, Fantasy",42,tt0486583,5.6,Fred Claus,PG,English,USA,"72,000,867",116 min,"Vince Vaughn, Paul Giamatti, John Michael Higgins, Miranda Richardson",David Dobkin,N/A,http://ia.media-imdb.com/images/M/MV5BMTY0NDEwNzc0N15BMl5BanBnXkFtZTcwNjgxNzUzMw@@._V1_SX300.jpg
5707203271a0650af414df15,22 Jun 2007,"Matt Greenberg (screenplay, Scott Alexander (screenplay, Larry Karaszewski (screenplay, Stephen King (short story)",movie,"203,986",True,"Fantasy, Horror",64,tt0450385,6.8,1408,PG-13,English,USA,"71,975,611",104 min,"John Cusack, Paul Birchard, Margot Leicester, Walter Lewis",Mikael Håfström,4 wins & 8 nominations.,http://ia.media-imdb.com/images/M/MV5BMTk1MDg0NTU0OV5BMl5BanBnXkFtZTcwMTM1NDk0MQ@@._V1_SX300.jpg
5707203271a0650af414df16,07 Dec 2007,"Chris Weitz (screenplay, Philip Pullman (novel)",movie,"146,156",True,"Adventure, Family, Fantasy",51,tt0385752,6.1,The Golden Compass,PG-13,"English, Icelandic, Russian, French","USA, UK","70,083,519",113 min,"Nicole Kidman, Daniel Craig, Dakota Blue Richards, Ben Walker",Chris Weitz,Won 1 Oscar. Another 4 wins & 32 nominations.,http://ia.media-imdb.com/images/M/MV5BMTM2NDkxMjQxMV5BMl5BanBnXkFtZTYwNTMxMDM4._V1_SX300.jpg
5707203271a0650af414df17,21 Dec 2007,"Aaron Sorkin (screenplay, George Crile (book)",movie,"86,744",True,"Biography, Comedy, Drama",69,tt0472062,7.1,Charlie Wilson's War,R,"English, Dari, Russian, Urdu, Hebrew, Arabic","USA, Germany","66,636,385",102 min,"Tom Hanks, Amy Adams, Julia Roberts, Philip Seymour Hoffman",Mike Nichols,Nominated for 1 Oscar. Another 5 wins & 20 nominations.,http://ia.media-imdb.com/images/M/MV5BMTgwMDgwMDc4MF5BMl5BanBnXkFtZTYwOTU3MDM4._V1_SX300.jpg
5707203271a0650af414df18,26 Oct 2007,"Patrick Melton (screenplay, Marcus Dunstan (screenplay, Patrick Melton (story, Marcus Dunstan (story, Thomas Fenton (story)",movie,"108,253",True,"Horror, Mystery",36,tt0890870,5.9,Saw IV,R,English,"USA, Canada","63,270,259",93 min,"Tobin Bell, Costas Mandylor, Scott Patterson, Betsy Russell",Darren Lynn Bousman,1 win & 6 nominations.,http://ia.media-imdb.com/images/M/MV5BNjc0NjUyNzg3MF5BMl5BanBnXkFtZTYwODMxOTM3._V1_SX300.jpg
5707203271a0650af414df19,12 Jan 2007,"Robert Adetuyi (screenplay, Gregory Ramon Anderson (earlier screenplay)",movie,"19,218",True,"Drama, Music, Romance",44,tt0775539,5.2,Stomp the Yard,PG-13,English,USA,,109 min,"Columbus Short, Meagan Good, Ne-Yo, Darrin Dewitt Henson",Sylvain White,9 nominations.,http://ia.media-imdb.com/images/M/MV5BMTU5NDA4NDE2Ml5BMl5BanBnXkFtZTcwNDMxMDIzMw@@._V1_SX300.jpg
5707203271a0650af414df1a,08 Jun 2007,"Don Rhymer (screenplay, Ash Brannon (screenplay, Chris Buck (screenplay, Christopher Jenkins (screenplay, Christopher Jenkins (story, Christian Darren (story)",movie,"52,251",True,"Animation, Comedy, Family",64,tt0423294,6.8,Surf's Up,PG,English,USA,,85 min,"Shia LaBeouf, Jeff Bridges, Zooey Deschanel, Jon Heder","Ash Brannon, Chris Buck",Nominated for 1 Oscar. Another 2 wins & 18 nominations.,http://ia.media-imdb.com/images/M/MV5BMjE4NDE3NzcwM15BMl5BanBnXkFtZTcwMTI0ODYzMw@@._V1_SX300.jpg
5707203271a0650af414df1b,23 Mar 2007,"Kevin Munroe, Peter Laird (characters, Kevin Eastman (characters)",movie,"52,838",True,"Animation, Action, Adventure",41,tt0453556,6.3,TMNT,PG,English,"Hong Kong, USA","54,132,596",87 min,"Chris Evans, Sarah Michelle Gellar, Mako, Kevin Smith",Kevin Munroe,2 nominations.,http://ia.media-imdb.com/images/M/MV5BMjE1MzcwNTE5OV5BMl5BanBnXkFtZTcwMTIxNzQ0MQ@@._V1_SX300.jpg
5707203271a0650af414df1c,21 Dec 2007,"Richard LaGravenese (screenplay, Steven Rogers (screenplay, Cecelia Ahern (novel)",movie,"163,017",True,"Drama, Romance",39,tt0431308,7.1,P.S. I Love You,PG-13,English,USA,"53,680,848",126 min,"Hilary Swank, Gerard Butler, Lisa Kudrow, Gina Gershon",Richard LaGravenese,2 wins & 4 nominations.,http://ia.media-imdb.com/images/M/MV5BNTg2MDg4MjI5NV5BMl5BanBnXkFtZTcwMzQ0MDczMw@@._V1_SX300.jpg
5707203271a0650af414df1d,21 Dec 2007,"John Logan (screenplay, Hugh Wheeler (musical, Christopher Bond (musical adaptation)",movie,"274,089",True,"Drama, Horror, Musical",83,tt0408236,7.4,Sweeney Todd: The Demon Barber of Fleet Street,R,"English, Italian","USA, UK","52,882,759",116 min,"Johnny Depp, Helena Bonham Carter, Alan Rickman, Timothy Spall",Tim Burton,Won 1 Oscar. Another 30 wins & 72 nominations.,http://ia.media-imdb.com/images/M/MV5BMTg3NjUxMzM5NV5BMl5BanBnXkFtZTcwMzQ1NjQzMw@@._V1_SX300.jpg
5707203271a0650af414df1e,11 Jan 2008,"Ian McEwan (novel, Christopher Hampton (screenplay)",movie,"187,614",True,"Drama, Mystery, Romance",85,tt0783233,7.8,Atonement,R,"English, French","UK, France, USA","50,921,738",123 min,"Saoirse Ronan, Ailidh Mackay, Brenda Blethyn, Julia West",Joe Wright,Won 1 Oscar. Another 48 wins & 144 nominations.,http://ia.media-imdb.com/images/M/MV5BMTM0ODc2Mzg1Nl5BMl5BanBnXkFtZTcwMTg4MDU1MQ@@._V1_SX300.jpg
5707203271a0650af414df1f,21 Sep 2007,Paul W.S. Anderson,movie,"145,490",True,"Action, Horror, Sci-Fi",41,tt0432021,6.3,Resident Evil: Extinction,R,English,"France, Australia, Germany, UK, USA",,94 min,"Milla Jovovich, Oded Fehr, Ali Larter, Iain Glen",Russell Mulcahy,2 wins & 1 nomination.,http://ia.media-imdb.com/images/M/MV5BMjA0NzIwMDI2MF5BMl5BanBnXkFtZTcwNzE1NTg0MQ@@._V1_SX300.jpg
5707203271a0650af414df20,14 Feb 2007,Marc Lawrence,movie,"79,638",True,"Comedy, Music, Romance",59,tt0758766,6.5,Music and Lyrics,PG-13,English,USA,"50,562,555",96 min,"Hugh Grant, Scott Porter, Nick Bacon, Andrew Wyatt",Marc Lawrence,6 nominations.,http://ia.media-imdb.com/images/M/MV5BNDY5MTQwODI3OV5BMl5BanBnXkFtZTcwODM2MjEzMw@@._V1_SX300.jpg
5707203271a0650af414df21,04 Apr 2007,"Hank Nelken (screenplay, Hank Nelken (screen story, Steven Gary Banks (characters, Claudia Grazioso (characters, Norman Panama (screenplay, Melvin Frank (screenplay)",movie,"15,202",True,"Comedy, Drama, Family",36,tt0422774,4.0,Are We Done Yet?,PG,English,"Canada, USA",,92 min,"Ice Cube, Nia Long, John C. McGinley, Aleisha Allen",Steve Carr,3 nominations.,http://ia.media-imdb.com/images/M/MV5BMTIwMDQyNjQzNl5BMl5BanBnXkFtZTcwMjEwODI0MQ@@._V1_SX300.jpg
5707203271a0650af414df22,21 Nov 2007,Preston A. Whitmore II,movie,"6,432",True,"Comedy, Drama, Romance",63,tt0937375,6.1,This Christmas,PG-13,English,USA,"49,121,934",117 min,"Delroy Lindo, Idris Elba, Loretta Devine, Chris Brown",Preston A. Whitmore II,4 nominations.,http://ia.media-imdb.com/images/M/MV5BMjE0NDY5Mzk2OF5BMl5BanBnXkFtZTYwNzI3MDM4._V1_SX300.jpg
5707203271a0650af414df23,12 Oct 2007,Tony Gilroy,movie,"130,981",True,"Crime, Drama, Mystery",82,tt0465538,7.3,Michael Clayton,R,English,USA,"49,024,969",119 min,"Tom Wilkinson, Michael O'Keefe, Sydney Pollack, Danielle Skraastad",Tony Gilroy,Won 1 Oscar. Another 26 wins & 109 nominations.,http://ia.media-imdb.com/images/M/MV5BMTc0NTU5MjI2MV5BMl5BanBnXkFtZTcwMTg5NTQzMw@@._V1_SX300.jpg
5707203271a0650af414df24,16 Mar 2007,Bill Kelly,movie,"61,387",True,"Drama, Mystery, Thriller",29,tt0477071,5.9,Premonition,PG-13,English,USA,"47,852,604",96 min,"Sandra Bullock, Julian McMahon, Shyann McClure, Courtney Taylor Burness",Mennan Yapo,2 nominations.,http://ia.media-imdb.com/images/M/MV5BMTY1MDU1MzAwOV5BMl5BanBnXkFtZTYwMDkzNzY3._V1_SX300.jpg
5707203271a0650af414df25,26 Oct 2007,"Pierce Gardner, Peter Hedges",movie,"85,109",True,"Comedy, Drama, Romance",65,tt0480242,6.8,Dan in Real Life,PG-13,English,USA,"47,636,541",98 min,"Steve Carell, Juliette Binoche, Dane Cook, Alison Pill",Peter Hedges,4 nominations.,http://ia.media-imdb.com/images/M/MV5BMjA2Nzc1NzQ1OV5BMl5BanBnXkFtZTcwOTE0MDE1MQ@@._V1_SX300.jpg
5707203271a0650af414df26,28 Sep 2007,Matthew Michael Carnahan,movie,"99,780",True,"Action, Drama, Thriller",56,tt0431197,7.1,The Kingdom,R,"English, Arabic","USA, Germany","47,456,450",110 min,"Jamie Foxx, Chris Cooper, Jennifer Garner, Jason Bateman",Peter Berg,5 nominations.,http://ia.media-imdb.com/images/M/MV5BMjA1MDIzOTYwMV5BMl5BanBnXkFtZTcwMTM5OTA1MQ@@._V1_SX300.jpg
5707203271a0650af414df27,23 Mar 2007,"Jonathan Lemkin (screenplay, Stephen Hunter (novel)",movie,"248,547",True,"Action, Crime, Drama",53,tt0822854,7.2,Shooter,R,English,USA,"46,975,183",124 min,"Mark Wahlberg, Michael Peña, Danny Glover, Kate Mara",Antoine Fuqua,1 nomination.,http://ia.media-imdb.com/images/M/MV5BMjA1NTU0Mzk4OF5BMl5BanBnXkFtZTcwNTc4MTY0MQ@@._V1_SX300.jpg
5707203271a0650af414df28,03 Jul 2007,"Kim Barker (screenplay, Tim Rasmussen (screenplay, Vince Di Meglio (screenplay, Kim Barker (story, Wayne Lloyd (story)",movie,"31,592",True,"Comedy, Romance",25,tt0762114,5.2,License to Wed,PG-13,English,"USA, Australia","43,792,641",91 min,"Robin Williams, Mandy Moore, John Krasinski, Eric Christian Olsen",Ken Kwapis,1 nomination.,http://ia.media-imdb.com/images/M/MV5BMTI5MTM2MjQ5NV5BMl5BanBnXkFtZTcwOTc3MDc0MQ@@._V1_SX300.jpg
