_id,Released,Writer,Type,imdbVotes,Response,Genre,Metascore,imdbID,imdbRating,Title,Rated,Language,Country,Box_office,Runtime,Actors,Director,Awards,Poster
5707203271a0650af414df69,04 Apr 2007,"Claire-Dee Lim, Mike Werb, Michael Colleary",movie,"4,657",True,"Action, Comedy, Family",43,tt0476995,5.5,Firehouse Dog,PG,English,"USA, Canada",,111 min,"Josh Hutcherson, Bruce Greenwood, Bill Nunn, Scotch Ellis Loring",Todd Holland,2 nominations.,http://ia.media-imdb.com/images/M/MV5BMTkyMDczNjYwMl5BMl5BanBnXkFtZTcwNzcxNzI0MQ@@._V1_SX300.jpg
5707203271a0650af414df6a,19 Oct 2007,"Ed Yeager (screenplay, Joey Gutierrez (screenplay, John Aboud (story, Michael Colton (story, Adam Jay Epstein (story, Andrew Jacobson (story)",movie,"9,843",True,"Comedy, Sport",25,tt0790804,4.1,The Comebacks,PG-13,English,USA,"13,349,251",84 min,"David Koechner, Carl Weathers, Melora Hardin, Matthew Lawrence",Tom Brady,1 nomination.,http://ia.media-imdb.com/images/M/MV5BNDI5OTAxMjc2OV5BMl5BanBnXkFtZTcwMDMzMDU1MQ@@._V1_SX300.jpg
5707203271a0650af414df6b,08 Aug 2007,"Geoff Rodkey (screenplay, J. David Stem (screenplay, David N. Weiss (screenplay, Geoff Rodkey (story, Joel Cohen (story, Alec Sokolow (story, Geoff Rodkey (characters)",movie,"12,077",True,"Comedy, Family",13,tt0462244,2.9,Daddy Day Camp,PG,English,USA,"13,235,267",93 min,"Cuba Gooding Jr., Lochlyn Munro, Richard Gant, Tamala Jones",Fred Savage,1 win & 5 nominations.,http://ia.media-imdb.com/images/M/MV5BMTM1NTUyMTExMF5BMl5BanBnXkFtZTcwNzk0MDI1MQ@@._V1_SX300.jpg
5707203271a0650af414df6c,07 Sep 2007,Michael Davis,movie,"127,896",True,"Action, Comedy, Crime",49,tt0465602,6.7,Shoot 'Em Up,R,"English, Italian",USA,"12,796,824",86 min,"Clive Owen, Paul Giamatti, Monica Bellucci, Stephen McHattie",Michael Davis,3 nominations.,http://ia.media-imdb.com/images/M/MV5BMjEwMDA1MDUwNl5BMl5BanBnXkFtZTcwMDQzMzM1MQ@@._V1_SX300.jpg
5707203271a0650af414df6d,16 Mar 2007,"Chris Rock (screenplay, Louis C.K. (screenplay, Éric Rohmer (motion picture \",movie,"13,647",True,"Comedy, Drama, Romance",49,tt0770772,5.5,I Think I Love My Wife,R,English,"USA, India","12,550,242",90 min,"Chris Rock, Kerry Washington, Gina Torres, Steve Buscemi",Chris Rock,1 nomination.,http://ia.media-imdb.com/images/M/MV5BMzA0NTcxODEyN15BMl5BanBnXkFtZTcwOTA4MjI0MQ@@._V1_SX300.jpg
5707203271a0650af414df6e,29 Jun 2007,"Susan Minot (screenplay, Michael Cunningham (screenplay, Susan Minot (novel)",movie,"11,492",True,"Drama, Romance",45,tt0765447,6.6,Evening,PG-13,English,"USA, Germany","12,406,646",117 min,"Claire Danes, Toni Collette, Vanessa Redgrave, Patrick Wilson",Lajos Koltai,2 nominations.,http://ia.media-imdb.com/images/M/MV5BMTQ3NTAzNzgzMV5BMl5BanBnXkFtZTcwMDIyMjY0MQ@@._V1_SX300.jpg
5707203271a0650af414df6f,26 Oct 2007,"Wes Anderson, Roman Coppola, Jason Schwartzman",movie,"134,523",True,"Adventure, Comedy, Drama",67,tt0838221,7.2,The Darjeeling Limited,R,"English, Hindi, German, Tibetan",USA,"11,896,380",91 min,"Owen Wilson, Adrien Brody, Jason Schwartzman, Amara Karan",Wes Anderson,4 wins & 3 nominations.,http://ia.media-imdb.com/images/M/MV5BMTM0MTQ4MTgwOF5BMl5BanBnXkFtZTcwMDA3MDU1MQ@@._V1_SX300.jpg
5707203271a0650af414df70,21 Sep 2007,Chad Gomez Creasey,movie,"36,768",True,"Comedy, Romance",45,tt0815244,6.3,Sydney White,PG-13,English,USA,"11,702,090",108 min,"Amanda Bynes, Sara Paxton, Matt Long, Jack Carpenter",Joe Nussbaum,N/A,http://ia.media-imdb.com/images/M/MV5BMTk3ODc3ODAxN15BMl5BanBnXkFtZTcwNzcwMDU1MQ@@._V1_SX300.jpg
5707203271a0650af414df71,20 Apr 2007,Jon Kasdan,movie,"27,313",True,"Comedy, Drama, Romance",47,tt0419843,6.5,In the Land of Women,PG-13,English,USA,"11,043,445",97 min,"Elena Anaya, Adam Brody, Kelsey Keel, Danielle Savre",Jon Kasdan,N/A,http://ia.media-imdb.com/images/M/MV5BMTQ4MDQ3NTExMV5BMl5BanBnXkFtZTcwMTA0OTM0MQ@@._V1_SX300.jpg
5707203271a0650af414df72,14 Sep 2007,Hyung-rae Shim,movie,"21,268",True,"Action, Drama, Fantasy",33,tt0372873,3.6,Dragon Wars: D-War,PG-13,"English, Korean",South Korea,"10,956,379",90 min,"Jason Behr, Amanda Brooks, Robert Forster, Craig Robinson",Hyung-rae Shim,1 nomination.,http://ia.media-imdb.com/images/M/MV5BMTc2OTk1MzUzMl5BMl5BanBnXkFtZTcwNjE0ODI1MQ@@._V1_SX300.jpg
5707203271a0650af414df73,12 Jan 2007,"John Brancato, Michael Ferris",movie,"10,881",True,"Action, Adventure, Crime",35,tt0772193,4.7,Primeval,R,"English, Swahili, Kirundi, French",USA,"10,596,100",93 min,"Dominic Purcell, Brooke Langton, Orlando Jones, Jürgen Prochnow",Michael Katleman,N/A,http://ia.media-imdb.com/images/M/MV5BMTI1NzUzNjY3Ml5BMl5BanBnXkFtZTcwOTY2ODA0MQ@@._V1_SX300.jpg
5707203271a0650af414df74,20 Jul 2007,"Isabelle Sobelman, Olivier Dahan",movie,"63,732",True,"Biography, Drama, Music",66,tt0450188,7.7,La Vie en Rose,PG-13,"French, English","France, UK, Czech Republic","10,299,782",140 min,"Marion Cotillard, Sylvie Testud, Pascal Greggory, Emmanuelle Seigner",Olivier Dahan,Won 2 Oscars. Another 43 wins & 61 nominations.,http://ia.media-imdb.com/images/M/MV5BMjExMjIzNjM5OV5BMl5BanBnXkFtZTcwMjc0OTg0MQ@@._V1_SX300.jpg
5707203271a0650af414df75,03 Aug 2007,"Susan Estelle Jansen (screenplay, Adam De La Peña (story, David Eilenberg (story)",movie,"14,538",True,"Comedy, Family, Music",21,tt0804452,2.8,Bratz,PG,"English, Spanish",USA,"10,005,534",110 min,"Logan Browning, Janel Parrish, Nathalia Ramos, Skyler Shaye",Sean McNamara,5 nominations.,http://ia.media-imdb.com/images/M/MV5BMTUxNDIwNjQ3OV5BMl5BanBnXkFtZTcwMjMzNjM1MQ@@._V1_SX300.jpg
5707203271a0650af414df76,19 Oct 2007,Kelley Sane,movie,"46,375",True,"Drama, Thriller",55,tt0804522,6.8,Rendition,R,"English, Arabic",USA,,122 min,"Jake Gyllenhaal, Reese Witherspoon, Meryl Streep, Alan Arkin",Gavin Hood,1 win & 2 nominations.,http://ia.media-imdb.com/images/M/MV5BMTk2MzcwMTIwOV5BMl5BanBnXkFtZTcwMDc4MjI1MQ@@._V1_SX300.jpg
5707203271a0650af414df77,31 Aug 2007,"Ian Mackenzie Jeffers (screenplay, Brian Garfield (novel)",movie,"58,980",True,"Action, Crime, Drama",36,tt0804461,6.8,Death Sentence,R,English,USA,"9,525,276",105 min,"Kevin Bacon, Garrett Hedlund, Kelly Preston, Jordan Garrett",James Wan,3 nominations.,http://ia.media-imdb.com/images/M/MV5BMTM1NDQzMDg1Ml5BMl5BanBnXkFtZTcwNzQ0OTk0MQ@@._V1_SX300.jpg
5707203271a0650af414df78,15 Jun 2007,John Carney,movie,"88,126",True,"Drama, Music, Romance",88,tt0907657,7.9,Once,R,"English, Czech",Ireland,"9,437,933",85 min,"Glen Hansard, Markéta Irglová, Hugh Walsh, Gerard Hendrick",John Carney,Won 1 Oscar. Another 19 wins & 30 nominations.,http://ia.media-imdb.com/images/M/MV5BMTEwNjExOTc2MTJeQTJeQWpwZ15BbWU3MDYzODQ3NDE@._V1_SX300.jpg
5707203271a0650af414df79,22 Jun 2007,"John Orloff (screenplay, Mariane Pearl (book)",movie,"23,835",True,"Biography, Drama, History",74,tt0829459,6.7,A Mighty Heart,R,"English, French, Urdu, Arabic","USA, UK",,108 min,"Dan Futterman, Angelina Jolie, Archie Panjabi, Mohammed Afzal",Michael Winterbottom,Nominated for 1 Golden Globe. Another 4 wins & 17 nominations.,http://ia.media-imdb.com/images/M/MV5BMTg4OTk0NDc3MV5BMl5BanBnXkFtZTcwOTU0ODc0MQ@@._V1_SX300.jpg
5707203271a0650af414df7a,05 Oct 2007,"John Hodge (screenplay, Susan Cooper (novel)",movie,"12,922",True,"Adventure, Drama, Family",38,tt0484562,4.8,The Seeker: The Dark Is Rising,PG,English,USA,"8,791,738",99 min,"Alexander Ludwig, Christopher Eccleston, Ian McShane, Frances Conroy",David L. Cunningham,N/A,http://ia.media-imdb.com/images/M/MV5BMTI4ODI5MzEwM15BMl5BanBnXkFtZTYwMTg4Njk3._V1_SX300.jpg
5707203271a0650af414df7b,05 Jan 2007,"Robert Adetuyi, George Gallo",movie,"9,656",True,"Action, Comedy, Crime",33,tt0462229,4.5,Code Name: The Cleaner,PG-13,English,USA,,84 min,"Cedric the Entertainer, Lucy Liu, Nicollette Sheridan, Mark Dacascos",Les Mayfield,2 nominations.,http://ia.media-imdb.com/images/M/MV5BODM0ODg1NDI0NF5BMl5BanBnXkFtZTcwMjk0NzA0MQ@@._V1_SX300.jpg
5707203271a0650af414df7c,11 May 2007,"Bear Aderhold, Tom Sullivan",movie,"9,477",True,"Action, Adventure, Comedy",17,tt0800003,3.4,Delta Farce,PG-13,"English, Spanish",USA,"8,074,933",90 min,"Michael Rose, Glenn Morshower, Larry the Cable Guy, Christina Moore",C.B. Harding,N/A,http://ia.media-imdb.com/images/M/MV5BMjAxODg1NzU3M15BMl5BanBnXkFtZTcwNjI2ODc0MQ@@._V1_SX300.jpg
5707203271a0650af414df7d,04 Oct 2007,Alexander Berberich,movie,120,True,"Short, Drama",N/A,tt1095453,8.0,Bella,N/A,English,Costa Rica,,N/A,Ampora Marie Sapp,Alexander Berberich,N/A,http://ia.media-imdb.com/images/M/MV5BODY3NzQ0MjkxOF5BMl5BanBnXkFtZTcwMTMzNTI1MQ@@._V1_SX300.jpg
5707203271a0650af414df7e,30 Oct 2007,N/A,movie,11,True,"Short, Biography, Music",N/A,tt1145169,7.2,The Sound and the Heat of El Cantante,N/A,"Spanish, English","Canada, USA",,36 min,"Jennifer Lopez, Marc Anthony, Leon Ichaso, David Maldonado",Julie Ng,N/A,N/A
5707203271a0650af414df7f,02 Nov 2007,"Seth Bass (screenplay, Jonathan Tolins (screenplay, David Gerrold (novel)",movie,"17,219",True,"Comedy, Drama, Family",48,tt0415965,6.8,Martian Child,PG,English,USA,"7,486,906",106 min,"John Cusack, Bobby Coleman, Amanda Peet, Sophie Okonedo",Menno Meyjes,2 nominations.,http://ia.media-imdb.com/images/M/MV5BMjExMDAxNzYzNV5BMl5BanBnXkFtZTcwMDQ3MDU1MQ@@._V1_SX300.jpg
5707203271a0650af414df80,27 Jul 2007,Jeff Hammond,movie,"22,790",True,"Crime, Mystery, Thriller",16,tt0897361,3.6,I Know Who Killed Me,R,English,USA,"7,233,485",105 min,"Bonnie Aarons, Lindsay Lohan, Michael Adler, Julia Ormond",Chris Sivertson,8 wins & 4 nominations.,http://ia.media-imdb.com/images/M/MV5BNTE5OTc5NTU1OV5BMl5BanBnXkFtZTcwMzQxMjU1MQ@@._V1_SX300.jpg
5707203271a0650af414df81,27 Apr 2007,"Scott Wiper (screenplay, Rob Hedden (screenplay, Rob Hedden (story, Andy Hedden (story, Scott Wiper (story)",movie,"44,373",True,"Action, Thriller",23,tt0443473,6.1,The Condemned,R,"English, Spanish, German",USA,"3,718",113 min,"Steve Austin, Vinnie Jones, Robert Mammone, Tory Mussett",Scott Wiper,1 nomination.,http://ia.media-imdb.com/images/M/MV5BNzkyOTczMjU0M15BMl5BanBnXkFtZTcwMDExMzM0MQ@@._V1_SX300.jpg
5707203271a0650af414df82,N/A,Walker O'Brien,movie,9,True,Thriller,N/A,tt1266072,5.2,The Hoax,N/A,English,USA,,96 min,"Gene Ganssle, Lynne Pyrce, Kathleen Benner, Brian Bozick",Huw Bowen,N/A,http://ia.media-imdb.com/images/M/MV5BMTY1MjU3MzMwNF5BMl5BanBnXkFtZTgwOTA3MjA2MDE@._V1_SX300.jpg
5707203271a0650af414df83,11 Jan 2008,Sergio G. Sánchez (screenplay),movie,"117,597",True,"Drama, Mystery, Thriller",74,tt0464141,7.5,The Orphanage,R,Spanish,Spain,,105 min,"Belén Rueda, Fernando Cayo, Roger Príncep, Mabel Rivera",J.A. Bayona,32 wins & 40 nominations.,http://ia.media-imdb.com/images/M/MV5BMTc3MjE0NzQzMV5BMl5BanBnXkFtZTYwMzI0ODc4._V1_SX300.jpg
5707203271a0650af414df84,07 Dec 2007,Kelly Masterson,movie,"80,643",True,"Crime, Drama, Thriller",84,tt0292963,7.3,Before the Devil Knows You're Dead,R,English,USA,"7,083,025",117 min,"Philip Seymour Hoffman, Ethan Hawke, Albert Finney, Marisa Tomei",Sidney Lumet,17 wins & 25 nominations.,http://ia.media-imdb.com/images/M/MV5BMTQ1NzM2ODQxNF5BMl5BanBnXkFtZTcwMDczMDU1MQ@@._V1_SX300.jpg
5707203271a0650af414df85,23 Mar 2007,"Kevin Michael Smith (screenplay, Michael Gozzard (screenplay, J. Mills Goodloe (screenplay, Norman Vance Jr. (screenplay, Kevin Michael Smith (story, Michael Gozzard (story)",movie,"5,455",True,"Drama, Family, Sport",55,tt0475355,5.8,Pride,PG,English,"Germany, USA","1,373,400",104 min,"Terrence Howard, Bernie Mac, Kimberly Elise, Tom Arnold",Sunu Gonera,2 wins & 3 nominations.,http://ia.media-imdb.com/images/M/MV5BMTIxMjk2MTM5NF5BMl5BanBnXkFtZTcwMDA0OTM0MQ@@._V1_SX300.jpg
5707203271a0650af414df86,29 Sep 2007,"Jonas Klinkenbijl, Martijn Smits",movie,21,True,"Short, Horror",N/A,tt1108828,6.9,The Bug,N/A,Dutch,Netherlands,,15 min,"Carry Tefsen, Jackie van Oppen, Ger Van Der Grijn, Nils Verkooijen",Martijn Smits,N/A,N/A
5707203271a0650af414df87,13 Apr 2007,"Robert Foreman (screenplay, Daniel Sadek (story)",movie,"7,791",True,Action,24,tt0780595,3.9,Redline,PG-13,English,USA,"6,877,133",95 min,"Nathan Phillips, Nadia Bjorlin, Angus Macfadyen, Eddie Griffin",Andy Cheng,1 nomination.,http://ia.media-imdb.com/images/M/MV5BODY1MTc3MjQ2MF5BMl5BanBnXkFtZTcwOTI4MTU0MQ@@._V1_SX300.jpg
5707203271a0650af414df88,28 Sep 2007,"Paul Haggis (screenplay, Mark Boal (story, Paul Haggis (story)",movie,"59,157",True,"Crime, Drama, Mystery",65,tt0478134,7.2,In the Valley of Elah,R,English,USA,"6,777,589",121 min,"Tommy Lee Jones, Charlize Theron, Jason Patric, Susan Sarandon",Paul Haggis,Nominated for 1 Oscar. Another 2 wins & 17 nominations.,http://ia.media-imdb.com/images/M/MV5BMTg2ODAxOTE2OF5BMl5BanBnXkFtZTcwODYxODE1MQ@@._V1_SX300.jpg
5707203271a0650af414df89,01 Feb 2008,Tamara Jenkins,movie,"31,807",True,"Comedy, Drama",85,tt0775529,7.2,The Savages,R,"English, German, Cantonese",USA,"6,610,326",113 min,"Laura Linney, Philip Seymour Hoffman, Philip Bosco, Peter Friedman",Tamara Jenkins,Nominated for 2 Oscars. Another 15 wins & 30 nominations.,http://ia.media-imdb.com/images/M/MV5BMTU5NjMyMjk0OF5BMl5BanBnXkFtZTYwNzM4MDM4._V1_SX300.jpg
5707203271a0650af414df8a,01 Feb 2008,"Ronald Harwood (screenplay, Jean-Dominique Bauby (book)",movie,"88,443",True,"Biography, Drama",92,tt0401383,8.0,The Diving Bell and the Butterfly,PG-13,French,"France, USA","5,990,075",112 min,"Mathieu Amalric, Emmanuelle Seigner, Marie-Josée Croze, Anne Consigny",Julian Schnabel,Nominated for 4 Oscars. Another 66 wins & 91 nominations.,http://ia.media-imdb.com/images/M/MV5BMTc3MjkzMDkxN15BMl5BanBnXkFtZTcwODAyMTU1MQ@@._V1_SX300.jpg
5707203271a0650af414df8b,02 Nov 2007,Nancy Oliver,movie,"112,575",True,"Comedy, Drama",70,tt0805564,7.4,Lars and the Real Girl,PG-13,"English, Spanish","USA, Canada","5,949,693",106 min,"Ryan Gosling, Emily Mortimer, Paul Schneider, R.D. Reid",Craig Gillespie,Nominated for 1 Oscar. Another 7 wins & 32 nominations.,http://ia.media-imdb.com/images/M/MV5BMTI4NDc1NDkwMV5BMl5BanBnXkFtZTcwNjgzMDE1MQ@@._V1_SX300.jpg
5707203271a0650af414df8c,17 Aug 2007,"Jez Butterworth (screenplay, Tom Butterworth (screenplay, Carlo Carlei (story, Peter Rader (story, Valerio Manfredi (story)",movie,"28,533",True,"Action, Adventure, Fantasy",37,tt0462396,5.4,The Last Legion,PG-13,English,"UK, Italy, France, Tunisia",,102 min,"Colin Firth, Ben Kingsley, Aishwarya Rai Bachchan, Peter Mullan",Doug Lefler,2 nominations.,http://ia.media-imdb.com/images/M/MV5BMTg2OTkwODU0OF5BMl5BanBnXkFtZTcwMjMyOTA1MQ@@._V1_SX300.jpg
5707203271a0650af414df8d,05 Oct 2007,Albert Leon,movie,"3,400",True,"Drama, Music",36,tt0756703,2.7,Feel the Noise,PG-13,"English, Spanish",USA,"5,867,786",86 min,"Rosa Arredondo, Luis Cruz, Melonie Diaz, Charles Duckworth",Alejandro Chomski,N/A,http://ia.media-imdb.com/images/M/MV5BMTUzODQyNTE2MV5BMl5BanBnXkFtZTcwMzQzMDU1MQ@@._V1_SX300.jpg
5707203271a0650af414df8e,12 Dec 2007,"Lance Rivera, Marc Calixte, Nat Mauldin, Jeff Stein",movie,"2,412",True,"Comedy, Family, Fantasy",32,tt0841032,4.3,The Perfect Holiday,PG,English,USA,"5,809,663",96 min,"Morris Chestnut, Gabrielle Union, Faizon Love, Charlie Murphy",Lance Rivera,2 nominations.,http://ia.media-imdb.com/images/M/MV5BMTIyMDM0NzQwNF5BMl5BanBnXkFtZTcwMjg1MTU1MQ@@._V1_SX300.jpg
5707203271a0650af414df8f,04 May 2007,"Eric Roth (screenplay, Curtis Hanson (screenplay, Eric Roth (story)",movie,"18,078",True,"Drama, Romance, Sport",49,tt0338216,5.9,Lucky You,PG-13,"English, Spanish","USA, Germany, Australia","5,755,286",124 min,"Phyllis Somerville, Eric Bana, Horatio Sanz, Drew Barrymore",Curtis Hanson,1 nomination.,http://ia.media-imdb.com/images/M/MV5BNzcyMzgwNzU2N15BMl5BanBnXkFtZTcwMDcyODYzMw@@._V1_SX300.jpg
5707203271a0650af414df90,27 Jul 2007,"Don Michael Paul, Bradley Allenstein, Robert Henny",movie,"13,745",True,"Comedy, Sport",18,tt0785077,2.0,Who's Your Caddy?,PG-13,English,USA,"5,694,308",93 min,"Mick Partridge, Big Boi, Faizon Love, Sherri Shepherd",Don Michael Paul,1 win & 1 nomination.,http://ia.media-imdb.com/images/M/MV5BMTY1MDQwMTYxNF5BMl5BanBnXkFtZTcwMTAwOTM1MQ@@._V1_SX300.jpg
5707203271a0650af414df91,13 Apr 2007,"Matt Maiellaro, Dave Willis",movie,"12,050",True,"Animation, Action, Adventure",54,tt0455326,6.9,Aqua Teen Hunger Force Colon Movie Film for Theaters,R,English,USA,"5,518,918",86 min,"Dana Snyder, Carey Means, Dave Willis, Andy Merrill","Matt Maiellaro, Dave Willis",N/A,http://ia.media-imdb.com/images/M/MV5BMTc0OTQwNzYyNF5BMl5BanBnXkFtZTcwMDc5NTM0MQ@@._V1_SX300.jpg
5707203271a0650af414df92,20 Nov 2007,N/A,movie,25,True,"Documentary, Short",N/A,tt1156320,7.8,Making of a True Story: Rescue Dawn,N/A,English,USA,,N/A,"Christian Bale, Galen Yuen, Steve Zahn",N/A,N/A,N/A
5707203271a0650af414df93,16 Nov 2007,"Ronald Harwood (screenplay, Gabriel García Márquez (novel)",movie,"18,795",True,"Drama, Romance",43,tt0484740,6.4,Love in the Time of Cholera,R,English,USA,"4,584,886",139 min,"Benjamin Bratt, Gina Bernard Forbes, Giovanna Mezzogiorno, Javier Bardem",Mike Newell,Nominated for 1 Golden Globe. Another 3 nominations.,http://ia.media-imdb.com/images/M/MV5BMTQ3OTE0OTM4N15BMl5BanBnXkFtZTcwNDg3OTI1MQ@@._V1_SX300.jpg
5707203271a0650af414df94,26 Oct 2007,"Eileen Chang (story, James Schamus (screenplay, Hui-Ling Wang (screenplay)",movie,"30,031",True,"Drama, Romance, Thriller",61,tt0808357,7.6,"Lust, Caution",NC-17,"Mandarin, Japanese, English, Hindi, Shanghainese, Cantonese","USA, China, Taiwan",,157 min,"Tony Chiu Wai Leung, Wei Tang, Joan Chen, Leehom Wang",Ang Lee,Nominated for 1 Golden Globe. Another 24 wins & 51 nominations.,http://ia.media-imdb.com/images/M/MV5BMTI3MDI5ODMyNl5BMl5BanBnXkFtZTcwMTM2MjA1MQ@@._V1_SX300.jpg
5707203271a0650af414df95,30 Mar 2007,Scott Frank,movie,"49,810",True,"Crime, Drama, Thriller",73,tt0427470,7.1,The Lookout,R,English,USA,"4,587,858",99 min,"Joseph Gordon-Levitt, Jeff Daniels, Matthew Goode, Isla Fisher",Scott Frank,1 win & 11 nominations.,http://ia.media-imdb.com/images/M/MV5BMjkyMzE5Nzg0OV5BMl5BanBnXkFtZTcwNTM3MzU0MQ@@._V1_SX300.jpg
5707203271a0650af414df96,03 Aug 2007,"Michael Genet (screenplay, Rick Famuyiwa (screenplay, Michael Genet (story)",movie,"8,376",True,"Biography, Drama, History",69,tt0796368,7.4,Talk to Me,R,English,USA,"4,472,823",118 min,"Don Cheadle, Chiwetel Ejiofor, Bruce McFee, Mike Epps",Kasi Lemmons,9 wins & 13 nominations.,http://ia.media-imdb.com/images/M/MV5BMTIwODE3NzM4Nl5BMl5BanBnXkFtZTcwNjUzNTg0MQ@@._V1_SX300.jpg
5707203271a0650af414df97,27 Apr 2007,"Trace Slobotkin, Josh Siegal, Dylan Morgan",movie,"6,154",True,Comedy,18,tt0772178,4.6,Kickin' It Old Skool,PG-13,English,"USA, Canada","4,500,147",108 min,"Jamie Kennedy, Maria Menounos, Miguel A. Núñez Jr., Michael Rosenbaum",Harvey Glazer,N/A,http://ia.media-imdb.com/images/M/MV5BMTU4NzU4OTAxM15BMl5BanBnXkFtZTcwODY0OTQ0MQ@@._V1_SX300.jpg
5707203271a0650af414df98,22 Feb 2008,"Marjane Satrapi (comic, Vincent Paronnaud (scenario)",movie,"68,392",True,"Animation, Biography, Drama",90,tt0808417,8.0,Persepolis,PG-13,"French, English, Persian, German","France, USA",,96 min,"Chiara Mastroianni, Danielle Darrieux, Catherine Deneuve, Simon Abkarian","Vincent Paronnaud, Marjane Satrapi",Nominated for 1 Oscar. Another 28 wins & 54 nominations.,http://ia.media-imdb.com/images/M/MV5BMzIxMDI0Nzc4NV5BMl5BanBnXkFtZTYwNjU5OTI4._V1_SX300.jpg
5707203271a0650af414df99,31 Aug 2007,Julie Delpy,movie,"26,395",True,"Comedy, Drama, Romance",67,tt0841044,6.8,2 Days in Paris,R,"English, French","France, Germany","4,432,981",96 min,"Adam Goldberg, Julie Delpy, Daniel Brühl, Marie Pillet",Julie Delpy,2 wins & 5 nominations.,http://ia.media-imdb.com/images/M/MV5BMjAyNTY3NTcyOF5BMl5BanBnXkFtZTcwMTcyMjM1MQ@@._V1_SX300.jpg
5707203271a0650af414df9a,07 Dec 2007,"Todd Haynes (screenplay, Oren Moverman (screenplay, Todd Haynes (story)",movie,"47,583",True,"Biography, Drama, Music",73,tt0368794,7.0,I'm Not There.,R,English,"USA, Germany, Canada","4,001,121",135 min,"Cate Blanchett, Ben Whishaw, Christian Bale, Richard Gere",Todd Haynes,Nominated for 1 Oscar. Another 26 wins & 45 nominations.,http://ia.media-imdb.com/images/M/MV5BMTY4MzM2MjcwNV5BMl5BanBnXkFtZTcwODg3MDU1MQ@@._V1_SX300.jpg
5707203271a0650af414df9b,31 Aug 2007,JoJo Henrickson,movie,"1,579",True,"Action, Adventure, Comedy",61,tt0859760,6.8,Ladrón que roba a ladrón,PG-13,Spanish,USA,"4,002,313",98 min,"Fernando Colunga, Miguel Varoni, Saúl Lisazo, Ivonne Montero",Joe Menendez,N/A,http://ia.media-imdb.com/images/M/MV5BODg4ODE4NzgyNV5BMl5BanBnXkFtZTcwNDM3Nzk0MQ@@._V1_SX300.jpg
5707203271a0650af414df9c,09 Nov 2007,"Alexandre Aja (story, Grégory Levasseur (story, Franck Khalfoun (screenplay, Alexandre Aja (screenplay, Grégory Levasseur (screenplay)",movie,"25,608",True,"Crime, Horror, Thriller",37,tt0804516,5.9,P2,R,"English, Portuguese, Spanish",USA,"3,992,339",98 min,"Wes Bentley, Rachel Nichols, Simon Reynolds, Philip Akin",Franck Khalfoun,1 nomination.,http://ia.media-imdb.com/images/M/MV5BMTk2Nzk5ODAxMF5BMl5BanBnXkFtZTcwNzA0MTU1MQ@@._V1_SX300.jpg
5707203271a0650af414df9d,19 Oct 2007,"Andrew Dominik (screenplay, Ron Hansen (novel)",movie,"133,715",True,"Biography, Crime, Drama",68,tt0443680,7.5,The Assassination of Jesse James by the Coward Robert Ford,R,"English, Danish","USA, Canada, UK","3,904,982",160 min,"Brad Pitt, Mary-Louise Parker, Brooklynn Proulx, Dustin Bollinger",Andrew Dominik,Nominated for 2 Oscars. Another 25 wins & 64 nominations.,http://ia.media-imdb.com/images/M/MV5BMTY2NDI2MTc2NV5BMl5BanBnXkFtZTcwNjA2NTQzMw@@._V1_SX300.jpg
5707203271a0650af414df9e,23 Feb 2012,"Benoît Guichard (scenario, Alain Desrochers (idea)",movie,"1,541",True,"Action, Drama, Thriller",N/A,tt0790602,5.5,Nitro,R,French,Canada,,90 min,"Guillaume Lemay-Thivierge, Lucie Laurier, Martin Matte, Raymond Bouchard",Alain Desrochers,1 win & 7 nominations.,http://ia.media-imdb.com/images/M/MV5BMTQ2NDQwNjY3OV5BMl5BanBnXkFtZTcwODg2MjI1MQ@@._V1_SX300.jpg
5707203271a0650af414df9f,27 Jul 2007,Alex Garland,movie,"184,765",True,"Adventure, Sci-Fi, Thriller",64,tt0448134,7.3,Sunshine,R,English,"UK, USA","3,675,072",107 min,"Cillian Murphy, Michelle Yeoh, Troy Garity, Rose Byrne",Danny Boyle,1 win & 17 nominations.,http://ia.media-imdb.com/images/M/MV5BMTU5Nzg2OTk2NF5BMl5BanBnXkFtZTYwNTc1ODM3._V1_SX300.jpg
5707203271a0650af414dfa0,09 Nov 2007,"Farah Khan (story, Mushtaq Sheikh (screenplay, Farah Khan (screenplay, Mayur Puri (dialogue)",movie,"27,055",True,"Action, Comedy, Drama",N/A,tt1024943,6.6,Om Shanti Om,PG-13,"Hindi, Urdu",India,,162 min,"Shah Rukh Khan, Arjun Rampal, Kiron Kher, Shreyas Talpade",Farah Khan,32 wins & 21 nominations.,http://ia.media-imdb.com/images/M/MV5BMTgwMTc5MzMxOF5BMl5BanBnXkFtZTcwOTA4MTU1MQ@@._V1_SX300.jpg
5707203271a0650af414dfa1,05 Oct 2007,"Robin Swicord (screenplay, Karen Joy Fowler (book)",movie,"21,139",True,"Comedy, Drama, Romance",61,tt0866437,6.8,The Jane Austen Book Club,PG-13,English,USA,"3,573,870",106 min,"Maria Bello, Emily Blunt, Kathy Baker, Amy Brenneman",Robin Swicord,2 nominations.,http://ia.media-imdb.com/images/M/MV5BMTY5MTYwMzM3MF5BMl5BanBnXkFtZTcwOTAxODM1MQ@@._V1_SX300.jpg
5707203271a0650af414dfa2,26 Jan 2007,"Ehren Kruger (screenplay, Christopher Landon (screenplay, Annette Curtis Klause (book)",movie,"15,186",True,"Drama, Fantasy, Horror",33,tt0397044,5.5,Blood and Chocolate,PG-13,"English, Romanian","USA, UK, Germany, Romania","3,525,161",98 min,"Agnes Bruckner, Hugh Dancy, Olivier Martinez, Katja Riemann",Katja von Garnier,N/A,http://ia.media-imdb.com/images/M/MV5BMTI0NDE2NDQ1N15BMl5BanBnXkFtZTcwODc4NjA0MQ@@._V1_SX300.jpg
5707203271a0650af414dfa3,28 Sep 2007,"Allison Burnett (screenplay, Charles Baxter (novel)",movie,"13,681",True,"Drama, Romance",51,tt0800027,6.7,Feast of Love,R,English,USA,"3,504,875",97 min,"Morgan Freeman, Greg Kinnear, Radha Mitchell, Billy Burke",Robert Benton,N/A,http://ia.media-imdb.com/images/M/MV5BOTE1NjU3ODkzNV5BMl5BanBnXkFtZTcwMjY2MjE1MQ@@._V1_SX300.jpg
5707203271a0650af414dfa4,19 Oct 2007,Allan Loeb,movie,"23,396",True,Drama,63,tt0469623,7.2,Things We Lost in the Fire,R,English,"USA, UK, Canada","2,849,142",118 min,"Halle Berry, Benicio Del Toro, David Duchovny, Alexis Llewellyn",Susanne Bier,4 wins & 1 nomination.,http://ia.media-imdb.com/images/M/MV5BMTcyNTc3NTY2MF5BMl5BanBnXkFtZTcwMTE3NzYzMw@@._V1_SX300.jpg
5707203271a0650af414dfa5,24 Aug 2007,"Michael Bortman (screenplay, Allison Burnett (screenplay, Michael Bortman (screen story, Allison Burnett (screen story, J.R. Moehringer (Los Angeles Times Magazine article)",movie,"18,121",True,"Drama, Sport",55,tt0416185,6.8,Resurrecting the Champ,PG-13,English,USA,"3,169,424",112 min,"Samuel L. Jackson, Josh Hartnett, Kathryn Morris, Dakota Goyo",Rod Lurie,2 nominations.,http://ia.media-imdb.com/images/M/MV5BMTc4MDI1MjIxMF5BMl5BanBnXkFtZTcwMTc2MDU2MQ@@._V1_SX300.jpg
5707203271a0650af414dfa6,24 Aug 2007,Franc. Reyes,movie,"2,125",True,"Crime, Drama, Thriller",40,tt0775488,5.5,Illegal Tender,R,English,USA,"3,054,430",108 min,"Michael Philip Del Rio, Samuel Molina, Rick Sepulveda, Manny Perez",Franc. Reyes,3 nominations.,http://ia.media-imdb.com/images/M/MV5BMTY0MTc0MzQzN15BMl5BanBnXkFtZTcwNzg4NjI1MQ@@._V1_SX300.jpg
5707203271a0650af414dfa7,01 Jun 2007,"Lisa Marie Petersen (screenplay, Karen Janszen (screenplay, Andrew Shue (story, Ken Himmelman (story, Davis Guggenheim (story)",movie,"3,571",True,"Biography, Drama, Sport",52,tt0441007,6.2,Gracie,PG-13,English,USA,"2,955,039",95 min,"Jesse Lee Soffer, Christopher Shand, Carly Schroeder, Karl Girolamo",Davis Guggenheim,1 win & 2 nominations.,http://ia.media-imdb.com/images/M/MV5BNzYxNDQ5MzUyMV5BMl5BanBnXkFtZTcwNTQ0MjY0MQ@@._V1_SX300.jpg
5707203271a0650af414dfa8,13 Jul 2007,"Larry Cohen (screenplay, Joseph Tura (screenplay, Larry Cohen (story)",movie,"20,397",True,"Crime, Mystery, Thriller",24,tt0374563,4.7,Captivity,R,English,"USA, Russia","2,626,800",96 min,"Elisha Cuthbert, Daniel Gillies, Pruitt Taylor Vince, Michael Harney",Roland Joffé,1 win & 4 nominations.,http://ia.media-imdb.com/images/M/MV5BMTczNjI3MzgxMV5BMl5BanBnXkFtZTcwNTkwNjM1MQ@@._V1_SX300.jpg
