_id,Released,Writer,Type,imdbVotes,Response,Genre,Metascore,imdbID,imdbRating,Title,Rated,Language,Country,Box_office,Runtime,Actors,Director,Awards,Poster
5707203271a0650af414dff0,03 Jul 2007,"Bill Guttentag (screenplay, Dan Sturman (screenplay, Elizabeth Bentley (screenplay, Bill Guttentag (story, Dan Sturman (story)",movie,"2,862",True,"Biography, History, War",76,tt0893356,7.9,Nanking,R,"Japanese, Mandarin, English",USA,"160,140",88 min,"Hugo Armstrong, Rosalind Chao, Stephen Dorff, John Getz","Bill Guttentag, Dan Sturman",6 wins & 5 nominations.,http://ia.media-imdb.com/images/M/MV5BMTY5MTAwMjI1NV5BMl5BanBnXkFtZTcwODAzMjc1MQ@@._V1_SX300.jpg
5707203271a0650af414dff1,N/A,Michael V.,movie,N/A,True,"Comedy, Music",N/A,tt1058736,N/A,Michael V: The Bubble G Anthology,N/A,Tagalog,Philippines,,N/A,"Michael V., Ogie Alcasid, Antonio Aquitania, Diego Llorico",Michael V.,N/A,N/A
5707203271a0650af414dff2,05 Jan 2007,"Bret McKinney, Mark Andrew Olsen, Kelly Kennemer",movie,"4,915",True,"Biography, Comedy, Drama",53,tt0422783,7.4,Music Within,R,English,USA,"153,205",94 min,"Clint Jung, Melissa George, Marion Ross, Rebecca De Mornay",Steven Sawalich,1 win & 1 nomination.,http://ia.media-imdb.com/images/M/MV5BMTM2MjE0NTcwNl5BMl5BanBnXkFtZTcwOTM0MDQ1NA@@._V1_SX300.jpg
5707203271a0650af414dff3,08 Jan 2007,N/A,movie,19,True,"Documentary, Short",N/A,tt0953896,7.1,The Making of 'Severance',N/A,English,UK,,34 min,"Jason Newmark, Danny Dyer, Claudie Blakley, Andy Nyman",William Prouty,N/A,http://ia.media-imdb.com/images/M/MV5BMTg2ODg5ODYyNF5BMl5BanBnXkFtZTcwNjU1MzM0MQ@@._V1_SX300.jpg
5707203271a0650af414dff4,11 Apr 2008,"Anne Sundberg, Ricki Stern",movie,"1,430",True,Documentary,78,tt0912580,7.8,The Devil Came on Horseback,N/A,"English, Arabic",USA,"132,309",85 min,"Nicholas Kristof, Brian Steidle","Ricki Stern, Anne Sundberg",5 wins & 4 nominations.,http://ia.media-imdb.com/images/M/MV5BMTQ2NTI4NDUwM15BMl5BanBnXkFtZTcwOTE0MjA1MQ@@._V1_SX300.jpg
5707203271a0650af414dff5,01 Oct 2008,Namrata Singh Gujral,movie,565,True,"Comedy, Drama, Romance",N/A,tt0485185,5.2,Americanizing Shelley,PG,English,USA,"126,403",90 min,"Namrata Singh Gujral, Beau Bridges, Brad Raider, RonReaco Lee",Lorraine Senna,N/A,http://ia.media-imdb.com/images/M/MV5BMTI0ODc3NTU5OV5BMl5BanBnXkFtZTcwODg4MjY0MQ@@._V1_SX300.jpg
5707203271a0650af414dff6,22 May 2007,N/A,movie,11,True,"Documentary, Short",N/A,tt1053885,7.6,The Making of 'Fay Grim' or: How Do You Spell Espionage?,N/A,English,USA,,17 min,"Hal Hartley, Parker Posey, Jeff Goldblum, Thomas Jay Ryan",N/A,N/A,N/A
5707203271a0650af414dff7,19 Apr 2009,N/A,movie,988,True,Documentary,71,tt0912590,7.3,Manda Bala (Send a Bullet),UNRATED,"English, Portuguese","Brazil, USA","111,444",85 min,N/A,Jason Kohn,7 wins & 5 nominations.,http://ia.media-imdb.com/images/M/MV5BMTg5OTU3MjM2Nl5BMl5BanBnXkFtZTcwMTQ0MzA1MQ@@._V1_SX300.jpg
5707203271a0650af414dff8,19 Jun 2008,"John Burnham Schwartz (screenplay, Terry George (screenplay, John Burnham Schwartz (novel)",movie,"18,408",True,"Crime, Drama, Thriller",46,tt0831884,6.7,Reservation Road,R,English,"USA, Germany","101,440",102 min,"Joaquin Phoenix, Elle Fanning, Jennifer Connelly, Sean Curley",Terry George,1 win & 2 nominations.,http://ia.media-imdb.com/images/M/MV5BMTkyMjc1MDc3Ml5BMl5BanBnXkFtZTcwNjEyNjM1MQ@@._V1_SX300.jpg
5707203271a0650af414dff9,11 Oct 2007,N/A,movie,N/A,True,"Short, Drama, Music",N/A,tt3522054,N/A,David,N/A,English,"Iceland, USA",,N/A,"Isaac Kellman Carlen, Isabella Estella, Justine Hanson, Nikolai Mynhardt",Avar Johannsson,N/A,N/A
5707203271a0650af414dffa,01 Nov 2008,"Sean Fine, Andrea Nix",movie,"1,027",True,"Documentary, Music, War",68,tt0912599,7.9,War Dance,PG-13,"Acholi, English",USA,"111,469",105 min,"Dominic, Nancy, Rose, Jane Adong","Sean Fine, Andrea Nix",Nominated for 1 Oscar. Another 10 wins & 3 nominations.,http://ia.media-imdb.com/images/M/MV5BMTM2OTA5MzU3Nl5BMl5BanBnXkFtZTcwMjQwMjU1MQ@@._V1_SX300.jpg
5707203271a0650af414dffb,06 Jul 2007,Sebastian Gutierrez,movie,"10,138",True,"Action, Horror, Mystery",N/A,tt0389328,4.9,Rise: Blood Hunter,R,English,USA,"106,398",97 min,"Robert Forster, Cameron Richardson, Lucy Liu, Allan Rich",Sebastian Gutierrez,N/A,http://ia.media-imdb.com/images/M/MV5BMjE1MjY2ODgxNF5BMl5BanBnXkFtZTcwNjA3NDc0MQ@@._V1_SX300.jpg
5707203271a0650af414dffc,06 Jun 2007,Erik D'Amato,series,N/A,True,Documentary,N/A,tt1047724,N/A,Budapest to Bamako,Unrated,N/A,N/A,,1 h 36 min,Scott Alexander Young,"Geza Villam, Tibor Vince Vinyus",N/A,N/A
5707203271a0650af414dffd,02 Nov 2007,Ted Braun,movie,640,True,Documentary,66,tt0988102,7.0,Darfur Now,PG,"Fur, Arabic, English, Spanish",USA,"107,841",98 min,"Ahmed Mahammed Abaka, Sheikh Ahmed Mohamad Abakar, Hawa Abaker, Hejewa Adam",Ted Braun,2 wins & 6 nominations.,http://ia.media-imdb.com/images/M/MV5BMTU5NTkyNjU3M15BMl5BanBnXkFtZTcwNzE3MDU1MQ@@._V1_SX300.jpg
5707203271a0650af414dffe,15 Aug 2008,Jonathan Demme,movie,736,True,"Documentary, Biography, History",58,tt0913958,7.0,Jimmy Carter Man from Plains,PG,English,USA,"108,282",125 min,"Lillian Carter, Jimmy Carter, Rosalynn Carter, Elizabeth Hayes",Jonathan Demme,3 wins & 2 nominations.,http://ia.media-imdb.com/images/M/MV5BMTUxNTAyODI3NV5BMl5BanBnXkFtZTcwOTQyOTI1MQ@@._V1_SX300.jpg
5707203271a0650af414dfff,25 Apr 2009,"Aaron Woolf, Ian Cheney, Curtis Ellis, Jeffrey K. Miller",movie,"1,692",True,Documentary,70,tt1112115,7.1,King Corn,UNRATED,English,USA,"81,368",88 min,"Bob Bledsoe, Earl L. Butz, Dawn Cheney, Ian Cheney",Aaron Woolf,N/A,http://ia.media-imdb.com/images/M/MV5BMzIyMDk4MDE4NF5BMl5BanBnXkFtZTcwODc4MDU1MQ@@._V1_SX300.jpg
5707203271a0650af414e000,14 Oct 2008,"Judy Hecht Dumontet, Mitchell Leib (story, Julius Robinson",movie,337,True,Comedy,22,tt0227671,5.5,Tortilla Heaven,PG-13,English,USA,"104,999",98 min,"José Zúñiga, Miguel Sandoval, Olivia Hussey, Elpidia Carrillo",Judy Hecht Dumontet,1 nomination.,http://ia.media-imdb.com/images/M/MV5BMTEwODgxMTA3NzVeQTJeQWpwZ15BbWU3MDIxNzI0NDE@._V1_SX300.jpg
5707203271a0650af414e001,26 Oct 2007,N/A,movie,771,True,"Documentary, Crime",65,tt1086340,6.7,Mr. Untouchable,R,English,USA,"103,590",92 min,"Leroy 'Nicky' Barnes, Don Ferrarone, Thelma Grant, Carol Hawkins-Williams",Marc Levin,N/A,http://ia.media-imdb.com/images/M/MV5BMTkyNzQ2NzcyNl5BMl5BanBnXkFtZTcwMDA1NzE1MQ@@._V1_SX300.jpg
5707203271a0650af414e002,N/A,N/A,movie,N/A,True,Documentary,N/A,tt1453263,N/A,The Making of Self-Medicated,N/A,English,USA,,63 min,"Kristina Anapau, Tommy Bell, Michael Bowen, Timothy Kendall",Matt Kresling,N/A,N/A
5707203271a0650af414e003,15 May 2007,Martin Smith,movie,43,True,Documentary,N/A,tt1075836,7.0,Stealing Klimt,N/A,"English, German",UK,,92 min,"Maria Altmann, Michael J. Bazyler, Hubertus Czernin, Gerbert Frodl",Jane Chablani,N/A,N/A
5707203271a0650af414e004,10 Oct 2008,David Bromberg,movie,"6,172",True,"Comedy, Drama, Romance",50,tt0490579,6.8,Dedication,R,English,USA,"91,169",95 min,"Tom Wilkinson, Billy Crudup, Christine Taylor, Bob Balaban",Justin Theroux,N/A,http://ia.media-imdb.com/images/M/MV5BMTM3MjA1NDE2Ml5BMl5BanBnXkFtZTcwNTI4ODA1MQ@@._V1_SX300.jpg
5707203271a0650af414e005,29 Apr 2007,N/A,movie,385,True,"Documentary, Music",81,tt1003116,8.4,Pete Seeger: The Power of Song,PG,English,USA,"175,099",93 min,"Joan Baez, Johnny Cash, Bill Clinton, Bob Dylan",Jim Brown,1 nomination.,http://ia.media-imdb.com/images/M/MV5BMTY5Mzg0NTM2M15BMl5BanBnXkFtZTcwMTk1Mjc1MQ@@._V1_SX300.jpg
5707203271a0650af414e006,10 May 2007,Doris Dörrie,movie,291,True,Documentary,N/A,tt0943512,6.0,How to Cook Your Life,PG-13,"English, German",Germany,"84,097",94 min,"Edward Espe Brown, Doris Dörrie",Doris Dörrie,N/A,http://ia.media-imdb.com/images/M/MV5BMjA1OTMwMDkzNV5BMl5BanBnXkFtZTcwNDc0OTI1MQ@@._V1_SX300.jpg
5707203271a0650af414e007,01 Mar 2007,N/A,movie,131,True,"Short, Sci-Fi",N/A,tt1600530,2.1,Revolver,NOT RATED,English,USA,,37 min,"Scott Brown, Ethan Marten, Gary Wade Morton, John Pycior",Kimball Carr,2 wins.,http://ia.media-imdb.com/images/M/MV5BMTU5MzgyMzMwNl5BMl5BanBnXkFtZTgwOTQ1Mzk2NDE@._V1_SX300.jpg
5707203271a0650af414e008,10 Aug 2007,Paul Schrader,movie,"4,505",True,"Crime, Drama, Mystery",55,tt0783608,5.9,The Walker,R,English,"USA, UK","77,177",108 min,"Woody Harrelson, Kristin Scott Thomas, Lauren Bacall, Ned Beatty",Paul Schrader,1 win.,http://ia.media-imdb.com/images/M/MV5BMjE4Mzg0MTcwOV5BMl5BanBnXkFtZTcwOTE2MjU1MQ@@._V1_SX300.jpg
5707203271a0650af414e009,02 Mar 2007,Kusum Punjabi (story),movie,"1,207",True,Drama,N/A,tt0824375,5.5,Nishabd,N/A,Hindi,India,,110 min,"Amitabh Bachchan, Jiah Khan, Revathy, Nasser",Ram Gopal Varma,N/A,http://ia.media-imdb.com/images/M/MV5BMjMwNzg0MTUwOF5BMl5BanBnXkFtZTgwNDgyMTA2MDE@._V1_SX300.jpg
5707203271a0650af414e00a,30 May 2008,"Robinson Devor, Charles Mudede",movie,"2,231",True,Documentary,63,tt0874423,5.6,Zoo,UNRATED,English,USA,"69,032",75 min,"Coyote, Jenny Edwards, John Edwards, John Paulsen",Robinson Devor,1 win & 3 nominations.,http://ia.media-imdb.com/images/M/MV5BNTk3MjkwODQ1OF5BMl5BanBnXkFtZTcwNzgzMTM0MQ@@._V1_SX300.jpg
5707203271a0650af414e00b,24 Oct 2007,N/A,movie,694,True,Documentary,N/A,tt0809439,6.8,Lagerfeld Confidential,N/A,"English, French",France,"66,510",89 min,"Karl Lagerfeld, Nicole Kidman, Brad Kroening, Princess Caroline of Monaco",Rodolphe Marconi,1 nomination.,http://ia.media-imdb.com/images/M/MV5BMTc1MjAwMjczMV5BMl5BanBnXkFtZTcwMzY3MDMwMg@@._V1_SX300.jpg
5707203271a0650af414e00c,04 Jun 2007,Cheryl Slean,movie,14,True,Short,N/A,tt1078282,6.4,Diggers,N/A,English,USA,,16 min,"Philip Davis, Marie Matiko, Austin Farwell, Nathan Gamble",Cheryl Slean,N/A,N/A
5707203271a0650af414e00d,20 Apr 2007,"Antonio Pennacchi (novel, Daniele Luchetti (story, Sandro Petraglia (story, Stefano Rulli (story)",movie,"5,021",True,"Comedy, Crime, Drama",71,tt0846040,7.1,My Brother Is an Only Child,R,Italian,"Italy, France","251,004",108 min,"Elio Germano, Riccardo Scamarcio, Angela Finocchiaro, Massimo Popolizio",Daniele Luchetti,20 wins & 22 nominations.,http://ia.media-imdb.com/images/M/MV5BMTQ0MTkyODA1OF5BMl5BanBnXkFtZTcwMzc4Mjc3MQ@@._V1_SX300.jpg
5707203271a0650af414e00e,16 Nov 2007,Brian De Palma,movie,"8,689",True,"Crime, Thriller, War",52,tt0937237,6.2,Redacted,R,"English, French, Arabic, German","USA, Canada","65,087",90 min,"Izzy Diaz, Rob Devaney, Ty Jones, Anas Wellman",Brian De Palma,5 wins & 2 nominations.,http://ia.media-imdb.com/images/M/MV5BMTM2OTY5MDAwNF5BMl5BanBnXkFtZTcwNTA4MTU1MQ@@._V1_SX300.jpg
5707203271a0650af414e00f,08 Aug 2007,Inbar Gilboa,movie,101,True,"Short, Drama, History",N/A,tt0903033,6.2,The Violin,N/A,"German, English",USA,,22 min,"Raviv Ullman, Sarah Drew, Melora Hardin, Michael Perl",Inbar Gilboa,1 win.,N/A
5707203271a0650af414e010,30 Nov 2007,John August,movie,"28,681",True,"Drama, Fantasy, Mystery",52,tt0810988,6.4,The Nines,R,English,USA,"62,745",100 min,"Ryan Reynolds, Melissa McCarthy, Hope Davis, Elle Fanning",John August,2 nominations.,http://ia.media-imdb.com/images/M/MV5BMTI5ODI5MTUzN15BMl5BanBnXkFtZTcwOTIwMTE1MQ@@._V1_SX300.jpg
5707203271a0650af414e011,N/A,N/A,series,34,True,Reality-TV,N/A,tt1157596,7.0,Maxed Out,N/A,English,Canada,,N/A,Alison Griffiths,N/A,N/A,N/A
5707203271a0650af414e012,21 Jan 2007,"Josh Diamond, Justin Lin",movie,"1,649",True,Comedy,46,tt0843850,6.2,Finishing the Game: The Search for a New Bruce Lee,NOT RATED,English,USA,"52,850",84 min,"Josh Diamond, Sam Bottoms, Jake Sandvig, Roger Fan",Justin Lin,1 win.,http://ia.media-imdb.com/images/M/MV5BMTA3MjczMTUxODReQTJeQWpwZ15BbWU3MDQ2MTA1NTE@._V1_SX300.jpg
5707203271a0650af414e013,11 Mar 2007,N/A,movie,471,True,Documentary,75,tt0971160,7.4,Billy the Kid,N/A,English,USA,,84 min,"Penny Baker, Billy P., Heather Pelletier",Jennifer Venditti,6 wins.,http://ia.media-imdb.com/images/M/MV5BODQ2OTE2MTc2Nl5BMl5BanBnXkFtZTcwMjg1OTg0MQ@@._V1_SX300.jpg
5707203271a0650af414e014,10 Jan 2008,James C. Strouse,movie,"8,110",True,Drama,65,tt0772168,6.8,Grace Is Gone,PG-13,English,USA,"50,080",85 min,"John Cusack, Emily Churchill, Rebecca Spence, Jennifer Tyler",James C. Strouse,Nominated for 2 Golden Globes. Another 4 wins & 5 nominations.,http://ia.media-imdb.com/images/M/MV5BMTQ1OTYyMDg5MF5BMl5BanBnXkFtZTcwNTY2MTU1MQ@@._V1_SX300.jpg
5707203271a0650af414e015,20 Sep 2007,"Ronald Kinnoch (story, Michael Noonan (novel, Marc Rosenberg (screenplay)",movie,"10,196",True,"Drama, Romance",56,tt0465436,6.6,December Boys,PG-13,"English, French",Australia,"46,474",105 min,"Daniel Radcliffe, Lee Cormie, Christian Byers, James Fraser",Rod Hardy,2 wins.,http://ia.media-imdb.com/images/M/MV5BMTkwMzg4NTg0Ml5BMl5BanBnXkFtZTcwMjg3OTA1MQ@@._V1_SX300.jpg
5707203271a0650af414e016,N/A,"David Eick, John McNamara",movie,102,True,"Drama, Sci-Fi",N/A,tt0947807,5.7,Them,N/A,N/A,USA,,N/A,"Rachel Nichols, Ben Feldman, James D'Arcy, Tricia Helfer",Jonathan Mostow,N/A,N/A
5707203271a0650af414e017,22 May 2009,Andrew Neel,movie,86,True,Documentary,60,tt0914358,8.1,Alice Neel,N/A,English,USA,"48,969",81 min,"Alice Neel, Michel Auder, Phillip Bonosky, Chuck Close",Andrew Neel,1 win.,http://ia.media-imdb.com/images/M/MV5BMTc3MzAzODEzMV5BMl5BanBnXkFtZTcwNjY3NTM0Mw@@._V1_SX300.jpg
5707203271a0650af414e018,06 Jun 2007,N/A,movie,"1,301",True,"Documentary, Biography, History",75,tt1032854,7.2,Terror's Advocate,UNRATED,"French, German, English, Khmer",France,"46,813",135 min,"Jacques Vergès, Bassam Abu Sharif, Klaus Barbie, Abderrahmane Benhamida",Barbet Schroeder,2 wins & 4 nominations.,http://ia.media-imdb.com/images/M/MV5BMTQxODYwMTMzOV5BMl5BanBnXkFtZTcwMjg4MDU1MQ@@._V1_SX300.jpg
5707203271a0650af414e019,26 Mar 2008,Jeff Nichols,movie,"6,719",True,"Drama, Thriller",76,tt0952682,7.3,Shotgun Stories,PG-13,English,USA,"45,661",92 min,"Michael Shannon, Douglas Ligon, Barlow Jacobs, Michael Abbott Jr.",Jeff Nichols,5 wins & 5 nominations.,http://ia.media-imdb.com/images/M/MV5BMTU0OTgzMTYyM15BMl5BanBnXkFtZTcwMjk1OTI0MQ@@._V1_SX300.jpg
5707203271a0650af414e01a,13 Oct 2007,Ray McKinnon,movie,305,True,"Comedy, Crime",N/A,tt0466943,6.1,Randy and the Mob,PG,English,USA,"45,098",91 min,"Ray McKinnon, Walton Goggins, Lisa Blount, Tim DeKay",Ray McKinnon,3 wins.,http://ia.media-imdb.com/images/M/MV5BMTUyMzg4NDE5MV5BMl5BanBnXkFtZTcwNzk0NjI1MQ@@._V1_SX300.jpg
5707203271a0650af414e01b,14 Sep 2007,Benjamin Gourley,movie,"3,345",True,"Adventure, Comedy, Romance",N/A,tt0444672,5.3,Moving McAllister,PG-13,English,USA,"42,200",89 min,"Benjamin Gourley, Mila Kunis, Jon Heder, Rutger Hauer",Andrew Black,N/A,http://ia.media-imdb.com/images/M/MV5BMTQwMDI5NDM0Nl5BMl5BanBnXkFtZTcwNDI4ODE1MQ@@._V1_SX300.jpg
5707203271a0650af414e01c,19 Oct 2007,"Janeen Damian, Michael Damian",movie,900,True,"Drama, Family",N/A,tt0828065,6.3,Moondance Alexander,G,English,USA,"26,631",94 min,"Kay Panabaker, Don Johnson, Lori Loughlin, James Best",Michael Damian,6 wins & 1 nomination.,http://ia.media-imdb.com/images/M/MV5BMTU0OTIyMDA1NF5BMl5BanBnXkFtZTcwNDkyNTM2MQ@@._V1_SX300.jpg
5707203271a0650af414e01d,03 Aug 2007,"Joe Gangemi, Steven Katz",movie,"17,253",True,"Drama, Horror, Thriller",52,tt0486051,5.9,Wind Chill,R,English,"USA, UK",,91 min,"Emily Blunt, Ashton Holmes, Martin Donovan, Ned Bellamy",Gregory Jacobs,N/A,http://ia.media-imdb.com/images/M/MV5BMTQxMzU3Nzk4MF5BMl5BanBnXkFtZTcwODA2NjU0MQ@@._V1_SX300.jpg
5707203271a0650af414e01e,06 Apr 2007,E. Paul Edwards,movie,167,True,"Drama, Romance",N/A,tt0354578,6.6,Fighting Words,R,English,USA,"35,081",89 min,"C. Thomas Howell, Jeff Stearns, Tara D'Agostino, Fred Willard",E. Paul Edwards,N/A,http://ia.media-imdb.com/images/M/MV5BMTk1MjcyMTg2MV5BMl5BanBnXkFtZTcwMzkyNTI1MQ@@._V1_SX300.jpg
5707203271a0650af414e01f,N/A,Allan B. Holt,movie,7,True,"Animation, Short",N/A,tt1072430,7.4,Canvas,N/A,N/A,USA,,5 min,N/A,Allan B. Holt,N/A,http://ia.media-imdb.com/images/M/MV5BMTMxNDU2ODM0M15BMl5BanBnXkFtZTcwOTM3MjE1MQ@@._V1_SX300.jpg
5707203271a0650af414e020,31 Oct 2007,"DeMar Richardson (story, DeMar Richardson",movie,6,True,"Short, Horror",N/A,tt1608764,7.5,Black Friday,N/A,English,USA,,38 min,"Tyrane Aiken, Monique Austin, Lloyd Evans, Nicholas George",DeMar Richardson,N/A,N/A
5707203271a0650af414e021,20 Jul 2007,Curt Johnson,movie,183,True,Documentary,N/A,tt0952693,6.6,Your Mommy Kills Animals!,R,English,USA,,105 min,"Greg Kelly, Paul Watson, Annemarie Lucas, Suzanne Whang",Curt Johnson,N/A,http://ia.media-imdb.com/images/M/MV5BMTY3MjY2MTkyNV5BMl5BanBnXkFtZTcwMDYzNTM0MQ@@._V1_SX300.jpg
5707203271a0650af414e022,19 Sep 2007,N/A,movie,N/A,True,Short,N/A,tt2048895,N/A,The Making of 'The Last Winter',N/A,English,USA,,5 min,"Connie Britton, Kevin Corrigan, Larry Fessenden, Zach Gilford",N/A,N/A,N/A
5707203271a0650af414e023,01 Mar 2007,"Marvin Hier, Richard Trank",movie,542,True,"Documentary, Biography",59,tt0763852,7.9,I Have Never Forgotten You: The Life & Legacy of Simon Wiesenthal,PG-13,"German, English",USA,"10,802",105 min,"Frederick Forsyth, Marvin Hier, Nicole Kidman, Ben Kingsley",Richard Trank,N/A,http://ia.media-imdb.com/images/M/MV5BMTQ2MDk3MDAzMV5BMl5BanBnXkFtZTcwNzE4ODM4Mg@@._V1_SX300.jpg
5707203271a0650af414e024,25 Apr 2007,N/A,movie,10,True,Documentary,N/A,tt1084657,7.7,Snow Cake: Behind the Scenes,TV-PG,English,USA,,8 min,"Marc Evans, Carrie-Anne Moss, Alan Rickman, Sigourney Weaver",N/A,N/A,N/A
5707203271a0650af414e025,01 Feb 2010,"Stephen Bates, Marie Cain, Shelly Markham, David Pevsner, Mark Savage, Robert Schrock, Rayme Sciaroni, Trance Thompson, Bruce Vilanch, Mark Winkler",movie,623,True,"Comedy, Musical",N/A,tt0928413,6.0,Naked Boys Singing!,N/A,English,USA,"25,526",95 min,"Andrew Blake Ames, Jason Currie, Jaymes Hodges, Joseph Keane","Robert Schrock, Troy Christian",1 win.,http://ia.media-imdb.com/images/M/MV5BMTcwMjA5MTE3M15BMl5BanBnXkFtZTcwNDg2MDU1MQ@@._V1_SX300.jpg
5707203271a0650af414e026,20 Oct 2007,Neil Kellen,movie,7,True,"Short, Horror",N/A,tt1374880,7.9,Forever,N/A,English,USA,,9 min,"Derek Mullins, Niccol Pinn, Bob Freeman",Neil Kellen,N/A,N/A
5707203271a0650af414e027,09 Jan 2009,"Stefan C. Schaefer (story, Stefan C. Schaefer, Yuta Silverman (story)",movie,"2,247",True,"Comedy, Drama, Romance",N/A,tt0848542,7.5,Arranged,N/A,"English, Hebrew, Arabic, Spanish",USA,"16,506",90 min,"Zoe Lister-Jones, Francis Benhamou, Mimi Lieber, John Rothman","Diane Crespo, Stefan C. Schaefer",6 wins.,http://ia.media-imdb.com/images/M/MV5BMTY1MzkyMzMwM15BMl5BanBnXkFtZTcwMTYwMzU1MQ@@._V1_SX300.jpg
5707203271a0650af414e028,22 Aug 2007,"Joe Swanberg, Greta Gerwig, Kent Osborne, Andrew Bujalski (additional material, Ry Russo-Young (additional material, Mark Duplass (additional material, Todd Rohal (additional material, Kevin Bewersdorf (additional material, Tipper Newton (additional material, Kris Swanberg (additional material)",movie,"1,242",True,"Comedy, Drama, Romance",63,tt0841108,5.6,Hannah Takes the Stairs,N/A,English,USA,"22,509",83 min,"Greta Gerwig, Kent Osborne, Andrew Bujalski, Ry Russo-Young",Joe Swanberg,N/A,http://ia.media-imdb.com/images/M/MV5BMTU4OTk2MjY4MF5BMl5BanBnXkFtZTcwNjgyMjg2MQ@@._V1_SX300.jpg
5707203271a0650af414e029,01 Nov 2007,Didier Volckaert,movie,15,True,Documentary,N/A,tt1160752,7.5,"Patrasche: A Dog of Flanders, Made in Japan",N/A,"Japanese, English, Flemish",Belgium,,90 min,"Caroline Donnely, Gunther Lesage","An Van Dienderen, Didier Volckaert",N/A,N/A
5707203271a0650af414e02a,18 Jan 2008,Jake Paltrow,movie,"7,449",True,"Comedy, Drama, Fantasy",49,tt0484111,5.9,The Good Night,R,"English, Italian","USA, UK, Germany","20,380",93 min,"Keith Allen, Steffan Boje, Penélope Cruz, Danny DeVito",Jake Paltrow,1 nomination.,http://ia.media-imdb.com/images/M/MV5BNTM1MTY4MDM3NF5BMl5BanBnXkFtZTcwMDE2OTMzMQ@@._V1_SX300.jpg
5707203271a0650af414e02b,18 Apr 2008,Micky Levy,movie,"3,416",True,Drama,44,tt0822849,6.8,Rails & Ties,PG-13,English,USA,"21,414",101 min,"Kevin Bacon, Marcia Gay Harden, Miles Heizer, Marin Hinkle",Alison Eastwood,1 nomination.,http://ia.media-imdb.com/images/M/MV5BMTQxMzEzNjI2Ml5BMl5BanBnXkFtZTcwMTc2MDU1MQ@@._V1_SX300.jpg
5707203271a0650af414e02c,30 Mar 2007,"George Smith, Craig Zobel",movie,989,True,"Comedy, Drama, Music",72,tt0826547,6.7,Great World of Sound,R,English,USA,"21,594",106 min,"Pat Healy, Kene Holiday, John Baker, Robert Longstreet",Craig Zobel,5 wins & 5 nominations.,http://ia.media-imdb.com/images/M/MV5BMTIxMTEyMTc0MF5BMl5BanBnXkFtZTcwNDczMTU1MQ@@._V1_SX300.jpg
5707203271a0650af414e02d,26 Nov 2007,Aaron Ramzi,movie,N/A,True,"Documentary, War",N/A,tt1435992,N/A,Close to Home,N/A,"English, Arabic",USA,,N/A,Aaron Ramzi,Aaron Ramzi,N/A,N/A
5707203271a0650af414e02e,01 Apr 2007,"Molly Bingham, Steve Connors",movie,87,True,Documentary,49,tt0823219,7.5,Meeting Resistance,N/A,"Arabic, English",USA,"20,469",84 min,N/A,"Molly Bingham, Steve Connors",1 win.,http://ia.media-imdb.com/images/M/MV5BMTQyMTIyOTg1N15BMl5BanBnXkFtZTgwMzcyMTA2MDE@._V1_SX300.jpg
5707203271a0650af414e02f,10 Mar 2007,Nick Stahr,movie,67,True,"Short, Comedy",N/A,tt1000705,6.2,Dirty Laundry,PG-13,English,USA,,5 min,"Bob Rue, Adam Devaney, Jose Rosete, John Waldron",Nick Stahr,1 nomination.,N/A
5707203271a0650af414e030,10 Mar 2007,Michèle Ohayon,movie,261,True,"Documentary, Romance",69,tt1045889,7.4,Steal a Pencil for Me,N/A,"English, Dutch",USA,,94 min,"J.P. Gillain, Jeroen Krabbé, Marieke Oudejans, Jack Polak",Michèle Ohayon,N/A,http://ia.media-imdb.com/images/M/MV5BMTYzNDkxODEwMF5BMl5BanBnXkFtZTcwMDcxMjU1MQ@@._V1_SX300.jpg
5707203271a0650af414e031,23 Mar 2007,Mars Callahan,movie,"1,065",True,Comedy,14,tt0439876,5.6,What Love Is,R,English,USA,,93 min,"Cuba Gooding Jr., Matthew Lillard, Sean Astin, Mars Callahan",Mars Callahan,N/A,http://ia.media-imdb.com/images/M/MV5BMTM0MzM5NzE1NV5BMl5BanBnXkFtZTcwMzI4MTE2MQ@@._V1_SX300.jpg
5707203271a0650af414e032,17 Aug 2007,"Raju Saigal (story, Anand Sivakumaran (screenplay)",movie,278,True,Comedy,N/A,tt1083447,2.5,Buddha Mar Gaya,N/A,Hindi,India,"13,871",93 min,"Mona Ambegaonkar, Jitender Bhargava, Birbal, Heenaa Biswas",Rahul Rawail,N/A,http://ia.media-imdb.com/images/M/MV5BMTU3NTIwNTk4Ml5BMl5BanBnXkFtZTgwMzYwMjA2MDE@._V1_SX300.jpg
5707203271a0650af414e033,28 Sep 2007,"Jamie Babbit (story, Tina Mabry, Abigail Shafran, Andrea Sperling (story)",movie,"2,432",True,"Comedy, Drama, Romance",N/A,tt0496328,5.6,Itty Bitty Titty Committee,NOT RATED,English,USA,"16,479",87 min,"Melonie Diaz, Ana Mercedes, Cecile Rivore, Marisa Ramirez",Jamie Babbit,7 wins & 1 nomination.,http://ia.media-imdb.com/images/M/MV5BMTU1NDEwOTY4MV5BMl5BanBnXkFtZTcwOTEwNjI0MQ@@._V1_SX300.jpg
5707203271a0650af414e034,06 Sep 2008,Adam Rifkin,movie,"1,465",True,"Comedy, Crime, Drama",50,tt0810951,6.7,Look,R,English,USA,"16,136",98 min,"Jamie McShane, Sebastian Feldman, Spencer Redford, Hayes MacArthur",Adam Rifkin,1 win.,http://ia.media-imdb.com/images/M/MV5BMTc1NDc1Njg5MF5BMl5BanBnXkFtZTcwMzk0MjU1MQ@@._V1_SX300.jpg
5707203271a0650af414e035,18 May 2007,Rajesh Jayaraman,movie,72,True,"Action, Crime, Thriller",N/A,tt0997185,4.3,Time,N/A,Malayalam,India,,N/A,"Suresh Gopi, Vimala Raman, Padmapriya, Sreekumar",Shaji Kailas,N/A,http://ia.media-imdb.com/images/M/MV5BMDZkZjc0YWEtYmQ2Yi00YmUzLWI5ODItZGQ3NWU4Zjc0ODVmXkEyXkFqcGdeQXVyMjkxNzQ1NDI@._V1_SX300.jpg
5707203271a0650af414e036,12 Mar 2007,"Erin Fisher, Aaron Katz, Cris Lankenau",movie,"1,243",True,Drama,N/A,tt0914382,6.5,Quiet City,UNRATED,English,USA,"15,425",78 min,"Erin Fisher, Cris Lankenau, Sarah Hellman, Joe Swanberg",Aaron Katz,2 wins & 1 nomination.,http://ia.media-imdb.com/images/M/MV5BMTQ0MjY2NzU3OV5BMl5BanBnXkFtZTcwNzg4MzE1MQ@@._V1_SX300.jpg
5707203271a0650af414e037,26 Apr 2007,"Brian Priest, Talia Lugacy",movie,"2,503",True,"Drama, Thriller",45,tt0463027,4.8,Descent,R,"English, Spanish",USA,"13,361",104 min,"Rosario Dawson, Chad Faust, Marcus Patrick, Vanessa Ferlito",Talia Lugacy,N/A,http://ia.media-imdb.com/images/M/MV5BMTcwMTE5MjY3MF5BMl5BanBnXkFtZTcwMTUzMzA1MQ@@._V1_SX300.jpg
5707203271a0650af414e038,05 Oct 2007,Thomas Lemmer,movie,39,True,Documentary,N/A,tt0899238,6.3,Desert Bayou,UNRATED,English,USA,,90 min,N/A,Alex LeMay,1 nomination.,http://ia.media-imdb.com/images/M/MV5BMzcyNTM3NTE0OF5BMl5BanBnXkFtZTcwMjc2MDU1MQ@@._V1_SX300.jpg
5707203271a0650af414e039,13 Jun 2008,"Jon Lucas (screenplay, Scott Moore (screenplay, Yoni Berkovits (story, Tony Dreannan (story, Tom Gammill (story, Max Pross (story)",movie,"2,922",True,"Drama, Comedy",33,tt0446752,5.7,Full of It,PG-13,English,"USA, South Africa, Italy","11,431",93 min,"Ryan Pinkston, Kate Mara, Teri Polo, Craig Kilborn",Christian Charles,N/A,http://ia.media-imdb.com/images/M/MV5BMTYzMDU5MjIzMV5BMl5BanBnXkFtZTcwMjE5OTE0MQ@@._V1_SX300.jpg
5707203271a0650af414e03a,01 Jun 2007,Caytha Jentis,movie,438,True,"Comedy, Romance",N/A,tt0825346,4.8,And Then Came Love,N/A,English,USA,,90 min,"Vanessa Williams, Kevin Daniels, Michael Boatman, Jeremy Gumbs",Richard Schenkman,N/A,http://ia.media-imdb.com/images/M/MV5BMTM2Mjk0Nzg4Nl5BMl5BanBnXkFtZTcwNDg1NzM2Nw@@._V1_SX300.jpg
5707203271a0650af414e03b,27 Jun 2007,"Mark Bomback (screenplay, Mark Bomback (story, David Marconi (story, John Carlin (article, Roderick Thorp (certain original characters)",movie,"329,631",True,"Action, Adventure, Thriller",69,tt0337978,7.2,Live Free or Die Hard,PG-13,"English, Italian, French","USA, UK","134,520,804",128 min,"Bruce Willis, Timothy Olyphant, Justin Long, Maggie Q",Len Wiseman,3 wins & 16 nominations.,http://ia.media-imdb.com/images/M/MV5BNDQxMDE1OTg4NV5BMl5BanBnXkFtZTcwMTMzOTQzMw@@._V1_SX300.jpg
5707203271a0650af414e03c,05 Oct 2007,"Karl Kozak, Don J. Rearden, Kraig Wenman",movie,567,True,"Action, Comedy",N/A,tt0775536,3.9,Skid Marks,R,English,USA,,85 min,"Tyler Poelle, Mikey Post, Scott Dittman, Kathy Uyen",Karl Kozak,N/A,http://ia.media-imdb.com/images/M/MV5BMjAyMjc1OTAzOV5BMl5BanBnXkFtZTcwNjkxNjA2Mg@@._V1_SX300.jpg
